Amolika,Priceless
Lubricity ,n.) Lasciviousness; propensity to lewdness; lewdness; lechery; incontinency.,,,,,,
Lubricous ,a.) Lubric.,,,,,,
Lubrification ,n.) Alt. of Lubrifaction,,,,,,
Lubrifaction ,"n.) The act of lubricating, or making smooth.",,,,,,
Lucarne ,n.) A dormer window.,,,,,,
Lucchese ,"n. sing. & pl.) A native or inhabitant of Lucca, in Tuscany; in the plural, the people of Lucca.",,,,,,
Luce ,n.) A pike when full grown.,,,,,,
Lucency ,n.) The quality of being lucent.,,,,,,
Lucent ,a.) Shining; bright; resplendent.,,,,,,
Lucern ,"n.) A sort of hunting dog; -- perhaps from Lucerne, in Switzerland.",,,,,,
Lucern ,n.) An animal whose fur was formerly much in request ,by some supposed to be the lynx).,,,,,
Lucern ,n.) A leguminous plant ,"Medicago sativa), having bluish purple cloverlike flowers, cultivated for fodder; -- called also alfalfa.",,,,,
Lucern ,n.) A lamp.,,,,,,
Lucernal ,a.) Of or pertaining to a lamp.,,,,,,
Lucernaria ,"n.) A genus of acalephs, having a bell-shaped body with eight groups of short tentacles around the margin. It attaches itself by a sucker at the base of the pedicel.",,,,,,
Lucernarian ,a.) Of or pertaining to the Lucernarida.,,,,,,
Lucernarian ,n.) One of the Lucernarida.,,,,,,
lucernarida ,"n. pl.) A division of acalephs, including Lucernaria and allied genera; -- called also Calycozoa.",,,,,,
lucernarida ,"n. pl.) A more extensive group of acalephs, including both the true lucernarida and the Discophora.",,,,,,
Lucerne ,"n.) See Lucern, the plant.",,,,,,
Lucid ,"n.) Shining; bright; resplendent; as, the lucid orbs of heaven.",,,,,,
Lucid ,n.) Clear; transparent.,,,,,,
Lucid ,n.) Presenting a clear view; easily understood; clear.,,,,,,
Lucid ,"n.) Bright with the radiance of intellect; not darkened or confused by delirium or madness; marked by the regular operations of reason; as, a lucid interval.",,,,,,
Lucidity ,n.) The quality or state of being lucid.,,,,,,
Lucidly ,adv.) In a lucid manner.,,,,,,
Lucidness ,n.) The quality of being lucid; lucidity.,,,,,,
Lucifer ,"n.) The planet Venus, when appearing as the morning star; -- applied in Isaiah by a metaphor to a king of Babylon.",,,,,,
Lucifer ,"n.) Hence, Satan.",,,,,,
Lucifer ,"n.) A match made of a sliver of wood tipped with a combustible substance, and ignited by friction; -- called also lucifer match, and locofoco. See Locofoco.",,,,,,
Lucifer ,"n.) A genus of free-swimming macruran Crustacea, having a slender body and long appendages.",,,,,,
Luciferian ,a.) Of or pertaining to Lucifer; having the pride of Lucifer; satanic; devilish.,,,,,,
Luciferian ,a.) Of or pertaining to the Luciferians or their leader.,,,,,,
Luciferian ,"n.) One of the followers of Lucifer, bishop of Cagliari, in the fourth century, who separated from the orthodox churches because they would not go as far as he did in opposing the Arians.",,,,,,
Luciferous ,a.) Giving light; affording light or means of discovery.,,,,,,
Luciferously ,adv.) In a luciferous manner.,,,,,,
Lucific ,a.) Producing light.,,,,,,
Luciform ,"a.) Having, in some respects, the nature of light; resembling light.",,,,,,
Lucifrian ,a.) Luciferian; satanic.,,,,,,
Lucimeter ,n.) an instrument for measuring the intensity of light; a photometer.,,,,,,
Luck ,"n.) That which happens to a person; an event, good or ill, affecting one's interests or happiness, and which is deemed casual; a course or series of such events regarded as occurring by chance; chance; hap; fate; fortune; often, one's habitual or characteristic fortune; as, good, bad, ill, or hard luck. Luck is often used for good luck; as, luck is better than skill.",,,,,,
Luckily ,"adv.) In a lucky manner; by good fortune; fortunately; -- used in a good sense; as, they luckily escaped injury.",,,,,,
Luckiness ,"n.) The state or quality of being lucky; as, the luckiness of a man or of an event.",,,,,,
Luckiness ,n.) Good fortune; favorable issue or event.,,,,,,
Luckless ,"a.) Being without luck; unpropitious; unfortunate; unlucky; meeting with ill success or bad fortune; as, a luckless gamester; a luckless maid.",,,,,,
Lucky ,"superl.) Favored by luck; fortunate; meeting with good success or good fortune; -- said of persons; as, a lucky adventurer.",,,,,,
Lucky ,"superl.) Producing, or resulting in, good by chance, or unexpectedly; favorable; auspicious; fortunate; as, a lucky mistake; a lucky cast; a lucky hour.",,,,,,
Lucky proach ,) See Fatherlasher.,,,,,,
Lucrative ,"a.) Yielding lucre; gainful; profitable; making increase of money or goods; as, a lucrative business or office.",,,,,,
Lucrative ,a.) Greedy of gain.,,,,,,
Lucratively ,adv.) In a lucrative manner.,,,,,,
Lucre ,n.) Gain in money or goods; profit; riches; -- often in an ill sense.,,,,,,
Lucriferous ,a.) Gainful; profitable.,,,,,,
Lucrific ,a.) Producing profit; gainful.,,,,,,
Luctation ,n.) Effort to overcome in contest; struggle; endeavor.,,,,,,
Luctual ,a.) Producing grief; saddening.,,,,,,
Lucubrated ,imp. & p. p.) of Lucubrate,,,,,,
Lucubrated ,p. pr. & vb. n.) of Lucubrate,,,,,,
Lucubrate ,n.) To study by candlelight or a lamp; to study by night.,,,,,,
Lucubrate ,"v. t.) To elaborate, perfect, or compose, by night study or by laborious endeavor.",,,,,,
Lucubration ,"n.) The act of lucubrating, or studying by candlelight; nocturnal study; meditation.",,,,,,
Lucubration ,n.) That which is composed by night; that which is produced by meditation in retirement; hence ,loosely) any literary composition.,,,,,
Lucubrator ,"n.) One who studies by night; also, one who produces lucubrations.",,,,,,
Lucubratory ,"a.) Composed by candlelight, or by night; of or pertaining to night studies; laborious or painstaking.",,,,,,
Lucule ,n.) A spot or fleck on the sun brighter than the surrounding surface.,,,,,,
Luculent ,a.) Lucid; clear; transparent.,,,,,,
Luculent ,a.) Clear; evident; luminous.,,,,,,
Luculent ,a.) Bright; shining in beauty.,,,,,,
Luculently ,adv.) In a luculent manner; clearly.,,,,,,
Lucullite ,"n.) A variety of black limestone, often polished for ornamental purposes.",,,,,,
Lucuma ,n.) An American genus of sapotaceous trees bearing sweet and edible fruits.,,,,,,
Luddite ,"n.) One of a number of riotous persons in England, who for six years ","1811-17) tried to prevent the use of labor-saving machinery by breaking it, burning factories, etc.; -- so called from Ned Lud, a half-witted man who some years previously had broken stocking frames.",,,,,
Ludibrious ,a.) Sportive; ridiculous; wanton.,,,,,,
Ludibund ,a.) Sportive.,,,,,,
Ludicrous ,"a.) Adapted to excite laughter, without scorn or contempt; sportive.",,,,,,
Ludification ,n.) The act of deriding.,,,,,,
Ludificatory ,a.) Making sport; tending to excite derision.,,,,,,
Ludlamite ,"n.) A mineral occurring in small, green, transparent, monoclinic crystals. It is a hydrous phosphate of iron.",,,,,,
Ludlow group ,") A subdivision of the British Upper Silurian lying below the Old Red Sandstone; -- so named from the Ludlow, in Western England. See the Chart of Geology.",,,,,,
Ludwigite ,"n.) A borate of iron and magnesia, occurring in fibrous masses of a blackish green color.",,,,,,
Lues ,"n.) Disease, especially of a contagious kind.",,,,,,
Luff ,n.) The side of a ship toward the wind.,,,,,,
Luff ,n.) The act of sailing a ship close to the wind.,,,,,,
Luff ,n.) The roundest part of a ship's bow.,,,,,,
Luff ,"n.) The forward or weather leech of a sail, especially of the jib, spanker, and other fore-and-aft sails.",,,,,,
Luffed ,imp. & p. p.) of Luff,,,,,,
Luffing ,p. pr. & vb. n.) of Luff,,,,,,
Luff ,v. i.) To turn the head of a vessel toward the wind; to sail nearer the wind; to turn the tiller so as to make the vessel sail nearer the wind.,,,,,,
Luffer ,n.) See Louver.,,,,,,
Lug ,"n.) The ear, or its lobe.",,,,,,
Lug ,"n.) That which projects like an ear, esp. that by which anything is supported, carried, or grasped, or to which a support is fastened; an ear; as, the lugs of a kettle; the lugs of a founder's flask; the lug ",handle) of a jug.,,,,,
Lug ,"n.) A projecting piece to which anything, as a rod, is attached, or against which anything, as a wedge or key, bears, or through which a bolt passes, etc.",,,,,,
Lug ,n.) The leather loop or ear by which a shaft is held up.,,,,,,
Lug ,n.) The lugworm.,,,,,,
Lugged ,imp. & p. p.) of Lug,,,,,,
Lugging ,p. pr. & vb. n.) of Lug,,,,,,
Lug ,"v. i.) To pull with force; to haul; to drag along; to carry with difficulty, as something heavy or cumbersome.",,,,,,
Lug ,v. i.) To move slowly and heavily.,,,,,,
Lug ,"n.) The act of lugging; as, a hard lug; that which is lugged; as, the pack is a heavy lug.",,,,,,
Lug ,n.) Anything which moves slowly.,,,,,,
Lug ,n.) A rod or pole.,,,,,,
Lug ,"n.) A measure of length, being 16/ feet; a rod, pole, or perch.",,,,,,
Luggage ,"n.) That which is lugged; anything cumbrous and heavy to be carried; especially, a traveler's trunks, baggage, etc., or their contents.",,,,,,
Lugger ,"n.) A small vessel having two or three masts, and a running bowsprit, and carrying lugsails. See Illustration in Appendix.",,,,,,
Lugger ,n.) An Indian falcon ,"Falco jugger), similar to the European lanner and the American prairie falcon.",,,,,
Lugmark ,n.) A mark cut into the ear of an animal to identify it; an earmark.,,,,,,
Lugsail ,n.) A square sail bent upon a yard that hangs obliquely to the mast and is raised or lowered with the sail.,,,,,,
Lugubrious ,"a.) Mournful; indicating sorrow, often ridiculously or feignedly; doleful; woful; pitiable; as, a whining tone and a lugubrious look.",,,,,,
Lugworm ,n.) A large marine annelid ,"Arenicola marina) having a row of tufted gills along each side of the back. It is found burrowing in sandy beaches, both in America and Europe, and is used for bait by European fishermen. Called also lobworm, and baitworm.",,,,,
Luke ,a.) Moderately warm; not hot; tepid.,,,,,,
Lukewarm ,a.) Moderately warm; neither cold nor hot; tepid; not ardent; not zealous; cool; indifferent.,,,,,,
Lulled ,imp. & p. p.) of Lull,,,,,,
Lulling ,p. pr. & vb. n.) of Lull,,,,,,
Lull ,v. t.) To cause to rest by soothing influences; to compose; to calm; to soothe; to quiet.,,,,,,
Lull ,"v. i.) To become gradually calm; to subside; to cease or abate for a time; as, the storm lulls.",,,,,,
Lull ,n.) The power or quality of soothing; that which soothes; a lullaby.,,,,,,
Lull ,n.) A temporary cessation of storm or confusion.,,,,,,
lullaby ,v. t.) A song to quiet babes or lull them to sleep; that which quiets.,,,,,,
lullaby ,v. t.) Hence: Good night; good-by.,,,,,,
Luller ,"n.) One who, or that which, lulls.",,,,,,
Lullingly ,adv.) In a lulling manner; soothingly.,,,,,,
Lum ,n.) A chimney.,,,,,,
Lum ,n.) A ventilating chimney over the shaft of a mine.,,,,,,
Lum ,"n.) A woody valley; also, a deep pool.",,,,,,
Lumachel ,n.) Alt. of Lumachella,,,,,,
Lumachella ,"n.) A grayish brown limestone, containing fossil shells, which reflect a beautiful play of colors. It is also called fire marble, from its fiery reflections.",,,,,,
Lumbaginous ,a.) Of or pertaining to lumbago.,,,,,,
Lumbago ,n.) A rheumatic pain in the loins and the small of the back.,,,,,,
Lumbar ,a.) Alt. of Lumbal,,,,,,
Lumbal ,"a.) Of, pertaining to, or near, the loins; as, the lumbar arteries.",,,,,,
Lumber ,"n.) A pawnbroker's shop, or room for storing articles put in pawn; hence, a pledge, or pawn.",,,,,,
Lumber ,"n.) Old or refuse household stuff; things cumbrous, or bulky and useless, or of small value.",,,,,,
Lumber ,"n.) Timber sawed or split into the form of beams, joists, boards, planks, staves, hoops, etc.; esp., that which is smaller than heavy timber.",,,,,,
Lumbered ,imp. & p. p.) of Lumber,,,,,,
Lumbering ,p. pr. & vb. n.) of Lumber,,,,,,
Lumber ,b. t.) To heap together in disorder.,,,,,,
Lumber ,"b. t.) To fill or encumber with lumber; as, to lumber up a room.",,,,,,
Lumber ,"v. i.) To move heavily, as if burdened.",,,,,,
Lumber ,v. i.) To make a sound as if moving heavily or clumsily; to rumble.,,,,,,
Lumber ,"v. i.) To cut logs in the forest, or prepare timber for market.",,,,,,
Lumberer ,"n.) One employed in lumbering, cutting, and getting logs from the forest for lumber; a lumberman.",,,,,,
Lumbering ,n.) The business of cutting or getting timber or logs from the forest for lumber.,,,,,,
Lumbermen ,pl. ) of Lumberman,,,,,,
Lumberman ,n.) One who is engaged in lumbering as a business or employment.,,,,,,
Lumbosacral ,"n.) Of or pertaining to the loins and sacrum; as, the lumbosacral nerve, a branch of one of the lumber nerves which passes over the sacrum.",,,,,,
Lumbric ,"n.) An earthworm, or a worm resembling an earthworm.",,,,,,
Lumbrical ,"a.) Resembling a worm; as, the lumbrical muscles of the hands of the hands and feet.",,,,,,
Lumbrical ,n.) A lumbrical muscle.,,,,,,
Lumbriciform ,a.) Resembling an earthworm; vermiform.,,,,,,
Lumbricoid ,"a.) Like an earthworm; belonging to the genus Lumbricus, or family Lumbricidae.",,,,,,
Lumbricus ,"n.) A genus of annelids, belonging to the Oligochaeta, and including the common earthworms. See Earthworm.",,,,,,
Luminant ,a.) Luminous.,,,,,,
Luminaries ,pl. ) of Luminary,,,,,,
Luminary ,"n.) Any body that gives light, especially one of the heavenly bodies.",,,,,,
Luminary ,"n.) One who illustrates any subject, or enlightens mankind; as, Newton was a distinguished luminary.",,,,,,
Luminate ,v. t.) To illuminate.,,,,,,
Lumination ,n.) Illumination.,,,,,,
Lumine ,v. i.) To illumine.,,,,,,
Luminiferous ,"a.) Producing light; yielding light; transmitting light; as, the luminiferous ether.",,,,,,
Luminosity ,n.) The quality or state of being luminous; luminousness.,,,,,,
Luminous ,"a.) Shining; emitting or reflecting light; brilliant; bright; as, the is a luminous body; a luminous color.",,,,,,
Luminous ,"a.) Illuminated; full of light; bright; as, many candles made the room luminous.",,,,,,
Luminous ,"a.) Enlightened; intelligent; also, clear; intelligible; as, a luminous mind.",,,,,,
Lummox ,"n.) A fat, ungainly, stupid person; an awkward bungler.",,,,,,
Lump ,"n.) A small mass of matter of irregular shape; an irregular or shapeless mass; as, a lump of coal; a lump of iron ore.",,,,,,
Lump ,n.) A mass or aggregation of things.,,,,,,
Lump ,n.) A projection beneath the breech end of a gun barrel.,,,,,,
Lumped ,imp. & p. p.) of Lump,,,,,,
Lumping ,p. pr. & vb. n.) of Lump,,,,,,
Lump ,v. i.) To throw into a mass; to unite in a body or sum without distinction of particulars.,,,,,,
Lump ,v. i.) To take in the gross; to speak of collectively.,,,,,,
Lump ,"v. i.) To get along with as one can, although displeased; as, if he does n't like it, he can lump it.",,,,,,
Lumper ,n.) The European eelpout; -- called also lumpen.,,,,,,
Lumper ,n.) One who lumps.,,,,,,
Lumper ,n.) A laborer who is employed to load or unload vessels when in harbor.,,,,,,
Lumpfish ,"n.) A large, thick, clumsy, marine fish ","Cyclopterus lumpus) of Europe and America. The color is usually translucent sea green, sometimes purplish. It has a dorsal row of spiny tubercles, and three rows on each side, but has no scales. The ventral fins unite and form a ventral sucker for adhesion to stones and seaweeds. Called also lumpsucker, cock-paddle, sea owl.",,,,,
Lumping ,a.) Bulky; heavy.,,,,,,
Lumpish ,a.) Like a lump; inert; gross; heavy; dull; spiritless.,,,,,,
Lumpsucker ,n.) The lumprish.,,,,,,
Lumpy ,"superl.) Full of lumps, or small compact masses.",,,,,,
Luna ,n.) The moon.,,,,,,
Luna ,n.) Silver.,,,,,,
Lunacies ,pl. ) of Lunacy,,,,,,
Lunacy ,"n.) Insanity or madness; properly, the kind of insanity which is broken by intervals of reason, -- formerly supposed to be influenced by the changes of the moon; any form of unsoundness of mind, except idiocy; mental derangement or alienation.",,,,,,
Lunacy ,"n.) A morbid suspension of good sense or judgment, as through fanaticism.",,,,,,
Lunar ,"a.) Of or pertaining to the moon; as, lunar observations.",,,,,,
Lunar ,a.) Resembling the moon; orbed.,,,,,,
Lunar ,"a.) Measured by the revolutions of the moon; as, a lunar month.",,,,,,
Lunar ,"a.) Influenced by the moon, as in growth, character, or properties; as, lunar herbs.",,,,,,
Lunar ,n.) A lunar distance.,,,,,,
Lunar ,"n.) The middle bone of the proximal series of the carpus; -- called also semilunar, and intermedium.",,,,,,
Lunarian ,n.) An inhabitant of the moon.,,,,,,
Lunary ,a.) Lunar.,,,,,,
Lunary ,"n.) The herb moonwort or ""honesty"".",,,,,,
Lunary ,n.) A low fleshy fern ,Botrychium Lunaria) with lunate segments of the leaf or frond.,,,,,
Lunate ,a.) Alt. of Lunated,,,,,,
Lunated ,"a.) Crescent-shaped; as, a lunate leaf; a lunate beak; a lunated cross.",,,,,,
Lunatic ,a.) Affected by lunacy; insane; mad.,,,,,,
Lunatic ,"a.) Of or pertaining to, or suitable for, an insane person; evincing lunacy; as, lunatic gibberish; a lunatic asylum.",,,,,,
Lunatic ,"n.) A person affected by lunacy; an insane person, esp. one who has lucid intervals; a madman; a person of unsound mind.",,,,,,
Lunation ,"n.) The period of a synodic revolution of the moon, or the time from one new moon to the next; varying in length, at different times, from about 29/ to 29/ days, the average length being 29 d., 12h., 44m., 2.9s.",,,,,,
Lunch ,"n.) A luncheon; specifically, a light repast between breakfast and dinner.",,,,,,
Lunched ,imp. & p. p.) of Lunch,,,,,,
Lunching ,p. pr. & vb. n.) of Lunch,,,,,,
Lunch ,v. i.) To take luncheon.,,,,,,
Luncheon ,n.) A lump of food.,,,,,,
Luncheon ,"n.) A portion of food taken at any time except at a regular meal; an informal or light repast, as between breakfast and dinner.",,,,,,
Luncheon ,v. i.) To take luncheon.,,,,,,
Lune ,n.) Anything in the shape of a half moon.,,,,,,
Lune ,"n.) A figure in the form of a crescent, bounded by two intersecting arcs of circles.",,,,,,
Lune ,n.) A fit of lunacy or madness; a period of frenzy; a crazy or unreasonable freak.,,,,,,
Lunet ,n.) A little moon or satellite.,,,,,,
Lunette ,"n.) A fieldwork consisting of two faces, forming a salient angle, and two parallel flanks. See Bastion.",,,,,,
Lunette ,"n.) A half horseshoe, which wants the sponge.",,,,,,
Lunette ,"n.) A kind of watch crystal which is more than ordinarily flattened in the center; also, a species of convexoconcave lens for spectacles.",,,,,,
Lunette ,n.) A piece of felt to cover the eye of a vicious horse.,,,,,,
Lunette ,"n.) Any surface of semicircular or segmental form; especially, the piece of wall between the curves of a vault and its springing line.",,,,,,
Lunette ,n.) An iron shoe at the end of the stock of a gun carriage.,,,,,,
Lung ,n.) An organ for aerial respiration; -- commonly in the plural.,,,,,,
Lunge ,"n.) A sudden thrust or pass, as with a sword.",,,,,,
Lunged ,imp. & p. p.) of Lunge,,,,,,
Lunging ,p. pr. & vb. n.) of Lunge,,,,,,
Lunge ,v. i.) To make a lunge.,,,,,,
Lunge ,"v. t.) To cause to go round in a ring, as a horse, while holding his halter.",,,,,,
Lunge ,n.) Same as Namaycush.,,,,,,
Lunged ,"a.) Having lungs, or breathing organs similar to lungs.",,,,,,
Lungfish ,n.) Any fish belonging to the Dipnoi; -- so called because they have both lungs and gills.,,,,,,
Lung-grown ,a.) Having lungs that adhere to the pleura.,,,,,,
Lungie ,n.) A guillemot.,,,,,,
Lungis ,"n.) A lingerer; a dull, drowsy fellow.",,,,,,
Lungless ,a.) Being without lungs.,,,,,,
Lungoor ,n.) A long-tailed monkey ,"Semnopithecus schislaceus), from the mountainous districts of India.",,,,,
Lungworm ,"n.) Any one of several species of parasitic nematoid worms which infest the lungs and air passages of cattle, sheep, and other animals, often proving fatal. The lungworm of cattle ",Strongylus micrurus) and that of sheep ,S. filaria) are the best known.,,,,
Lungwort ,n.) An herb of the genus Pulmonaria ,"P. officinalis), of Europe; -- so called because the spotted appearance of the leaves resembles that of a diseased lung.",,,,,
Lungwort ,n.) Any plant of the genus Mertensia ,"esp. M. Virginica and M. Sibirica) plants nearly related to Pulmonaria. The American lungwort is Mertensia Virginica, Virginia cowslip.",,,,,
Lunicurrent ,a.) Having relation to changes in currents that depend on the moon's phases.,,,,,,
Luniform ,a.) Resembling the moon in shape.,,,,,,
Lunisolar ,"a.) Resulting from the united action, or pertaining to the mutual relations, of the sun and moon.",,,,,,
Lunistice ,"n.) The farthest point of the moon's northing and southing, in its monthly revolution.",,,,,,
Lunitidal ,a.) Pertaining to tidal movements dependent on the moon.,,,,,,
Lunt ,n.) The match cord formerly used in firing cannon.,,,,,,
Lunt ,n.) A puff of smoke.,,,,,,
Lunulae ,pl. ) of Lunula,,,,,,
Lunula ,n.) Same as Lunule.,,,,,,
Lunular ,a.) Having a form like that of the new moon; shaped like a crescent.,,,,,,
Lunulate ,a.) Alt. of Lunulated,,,,,,
Lunulated ,a.) Resembling a small crescent.,,,,,,
Lunule ,"n.) Anything crescent-shaped; a crescent-shaped part or mark; a lunula, a lune.",,,,,,
Lunule ,n.) A lune. See Lune.,,,,,,
Lunule ,n.) A small or narrow crescent.,,,,,,
Lunule ,"n.) A special area in front of the beak of many bivalve shells. It sometimes has the shape of a double crescent, but is oftener heart-shaped. See Illust. of Bivalve.",,,,,,
Lunulet ,"n.) A small spot, shaped like a half-moon or crescent; as, the lunulet on the wings of many insects.",,,,,,
Lunulite ,"n.) Any bryozoan of the genus Lunulites, having a more or less circular form.",,,,,,
Luny ,a.) Crazy; mentally unsound.,,,,,,
Lupercal ,a.) Of or pertaining to the Lupercalia.,,,,,,
Lupercal ,"n.) A grotto on the Palatine Hill sacred to Lupercus, the Lycean Pan.",,,,,,
Lupercalia ,"n. pl.) A feast of the Romans in honor of Lupercus, or Pan.",,,,,,
Lupine ,"n.) A leguminous plant of the genus Lupinus, especially L. albus, the seeds of which have been used for food from ancient times. The common species of the Eastern United States is L. perennis. There are many species in California.",,,,,,
Lupine ,n.) Wolfish; ravenous.,,,,,,
Lupinin ,"n.) A glucoside found in the seeds of several species of lupine, and extracted as a yellowish white crystalline substance.",,,,,,
Lupinine ,n.) An alkaloid found in several species of lupine ,"Lupinus luteus, L. albus, etc.), and extracted as a bitter crystalline substance.",,,,,
Lupulin ,n.) A bitter principle extracted from hops.,,,,,,
Lupulin ,"n.) The fine yellow resinous powder found upon the strobiles or fruit of hops, and containing this bitter principle.",,,,,,
Lupuline ,n.) An alkaloid extracted from hops as a colorless volatile liquid.,,,,,,
Lupulinic ,"a.) Pertaining to, or obtained from, hops; specifically, designating an acid obtained by the decomposition of lupulin.",,,,,,
Lupus ,n.) A cutaneous disease occurring under two distinct forms.,,,,,,
Lupus ,"n.) The Wolf, a constellation situated south of Scorpio.",,,,,,
Lurcation ,n.) Gluttony; gormandizing.,,,,,,
Lurch ,"v. i.) To swallow or eat greedily; to devour; hence, to swallow up.",,,,,,
Lurch ,n.) An old game played with dice and counters; a variety of the game of tables.,,,,,,
Lurch ,n.) A double score in cribbage for the winner when his adversary has been left in the lurch.,,,,,,
Lurch ,v. t.) To leave in the lurch; to cheat.,,,,,,
Lurch ,v. t.) To steal; to rob.,,,,,,
Lurch ,"n.) A sudden roll of a ship to one side, as in heavy weather; hence, a swaying or staggering movement to one side, as that by a drunken man. Fig.: A sudden and capricious inclination of the mind.",,,,,,
Lurched ,imp. & p. p.) of Lurch,,,,,,
Lurching ,p. pr. & vb. n.) of Lurch,,,,,,
Lurch ,"v. i.) To roll or sway suddenly to one side, as a ship or a drunken man.",,,,,,
Lurch ,"v. i.) To withdraw to one side, or to a private place; to lurk.",,,,,,
Lurch ,v. i.) To dodge; to shift; to play tricks.,,,,,,
Lurcher ,"n.) One that lurches or lies in wait; one who watches to pilfer, or to betray or entrap; a poacher.",,,,,,
Lurcher ,"n.) One of a mongrel breed of dogs said to have been a cross between the sheep dog, greyhound, and spaniel. It hunts game silently, by scent, and is often used by poachers.",,,,,,
Lurcher ,n.) A glutton; a gormandizer.,,,,,,
Lurchline ,n.) The line by which a fowling net was pulled over so as to inclose the birds.,,,,,,
Lurdan ,a.) Stupid; blockish.,,,,,,
Lurdan ,n.) A blockhead.,,,,,,
Lure ,"n.) A contrivance somewhat resembling a bird, and often baited with raw meat; -- used by falconers in recalling hawks.",,,,,,
Lure ,n.) Any enticement; that which invites by the prospect of advantage or pleasure; a decoy.,,,,,,
Lure ,n.) A velvet smoothing brush.,,,,,,
Lured ,imp. & p. p.) of Lure,,,,,,
Luring ,p. pr. & vb. n.) of Lure,,,,,,
Lure ,"n.) To draw to the lure; hence, to allure or invite by means of anything that promises pleasure or advantage; to entice; to attract.",,,,,,
Lure ,v. i.) To recall a hawk or other animal.,,,,,,
Lurg ,n.) A large marine annelid ,"Nephthys caeca), inhabiting the sandy shores of Europe and America. It is whitish, with a pearly luster, and grows to the length of eight or ten inches.",,,,,
Lurid ,a.) Pale yellow; ghastly pale; wan; gloomy; dismal.,,,,,,
Lurid ,"a.) Having a brown color tonged with red, as of flame seen through smoke.",,,,,,
Lurid ,"a.) Of a color tinged with purple, yellow, and gray.",,,,,,
Lurked ,imp. & p. p.) of Lurk,,,,,,
Lurking ,p. pr. & vb. n.) of Lurk,,,,,,
Lurk ,v. i.) To lie hid; to lie in wait.,,,,,,
Lurk ,v. i.) To keep out of sight.,,,,,,
Lurker ,n.) One who lurks.,,,,,,
Lurker ,n.) A small fishing boat.,,,,,,
Lurry ,"n.) A confused heap; a throng, as of persons; a jumble, as of sounds.",,,,,,
Luscious ,a.) Sweet; delicious; very grateful to the taste; toothsome; excessively sweet or rich.,,,,,,
Luscious ,a.) Cloying; fulsome.,,,,,,
Luscious ,a.) Gratifying a depraved sense; obscene.,,,,,,
Lusern ,n.) A lynx. See 1st Lucern and Loup-cervier.,,,,,,
Lush ,a.) Full of juice or succulence.,,,,,,
Lushburg ,n.) See Lussheburgh.,,,,,,
Lusitanian ,"a.) Pertaining to Lusitania, the ancient name of the region almost coinciding with Portugal.",,,,,,
