Amolika,Priceless
Singleness ,"n.) Freedom from duplicity, or secondary and selfish ends; purity of mind or purpose; simplicity; sincerity; as, singleness of purpose; singleness of heart.",,,,,,
Singles ,"n. pl.) See Single, n., 2.",,,,,,
Singlestick ,"n.) In England and Scotland, a cudgel used in fencing or fighting; a backsword.",,,,,,
Singlestick ,"n.) The game played with singlesticks, in which he who first brings blood from his adversary's head is pronounced victor; backsword; cudgeling.",,,,,,
Singlet ,n.) An unlined or undyed waistcoat; a single garment; -- opposed to doublet.,,,,,,
Singleton ,"n.) In certain games at cards, as whist, a single card of any suit held at the deal by a player; as, to lead a singleton.",,,,,,
Singletree ,n.) The pivoted or swinging bar to which the traces of a harnessed horse are fixed; a whiffletree.,,,,,,
Singly ,"adv.) Individually; particularly; severally; as, to make men singly and personally good.",,,,,,
Singly ,adv.) Only; by one's self; alone.,,,,,,
Singly ,"adv.) Without partners, companions, or associates; single-handed; as, to attack another singly.",,,,,,
Singly ,adv.) Honestly; sincerely; simply.,,,,,,
Singly ,adv.) Singularly; peculiarly.,,,,,,
Sing-sing ,n.) The kob.,,,,,,
Singsong ,n.) Bad singing or poetry.,,,,,,
Singsong ,"n.) A drawling or monotonous tone, as of a badly executed song.",,,,,,
Singsong ,a.) Drawling; monotonous.,,,,,,
Singsong ,v. i.) To write poor poetry.,,,,,,
Singster ,n.) A songstress.,,,,,,
Singular ,a.) Separate or apart from others; single; distinct.,,,,,,
Singular ,a.) Engaged in by only one on a side; single.,,,,,,
Singular ,a.) Existing by itself; single; individual.,,,,,,
Singular ,"a.) Each; individual; as, to convey several parcels of land, all and singular.",,,,,,
Singular ,"a.) Denoting one person or thing; as, the singular number; -- opposed to dual and plural.",,,,,,
Singular ,"a.) Standing by itself; out of the ordinary course; unusual; uncommon; strange; as, a singular phenomenon.",,,,,,
Singular ,"a.) Distinguished as existing in a very high degree; rarely equaled; eminent; extraordinary; exceptional; as, a man of singular gravity or attainments.",,,,,,
Singular ,a.) Departing from general usage or expectations; odd; whimsical; -- often implying disapproval or consure.,,,,,,
Singular ,"a.) Being alone; belonging to, or being, that of which there is but one; unique.",,,,,,
Singular ,n.) An individual instance; a particular.,,,,,,
Singular ,"n.) The singular number, or the number denoting one person or thing; a word in the singular number.",,,,,,
Singularist ,n.) One who affects singularity.,,,,,,
Singularities ,pl. ) of Singularity,,,,,,
Singularity ,"n.) The quality or state of being singular; some character or quality of a thing by which it is distinguished from all, or from most, others; peculiarity.",,,,,,
Singularity ,"n.) Anything singular, rare, or curious.",,,,,,
Singularity ,"n.) Possession of a particular or exclusive privilege, prerogative, or distinction.",,,,,,
Singularity ,n.) Celibacy.,,,,,,
Singularize ,v. t.) To make singular or single; to distinguish.,,,,,,
Singularly ,"adv.) In a singular manner; in a manner, or to a degree, not common to others; extraordinarily; as, to be singularly exact in one's statements; singularly considerate of others.",,,,,,
Singularly ,"adv.) Strangely; oddly; as, to behave singularly.",,,,,,
Singularly ,"adv.) So as to express one, or the singular number.",,,,,,
Singult ,"n.) A sigh or sobbing; also, a hiccough.",,,,,,
Singultous ,"a.) Relating to, or affected with, hiccough.",,,,,,
Singultus ,n.) Hiccough.,,,,,,
Sinical ,"a.) Of or pertaining to a sine; employing, or founded upon, sines; as, a sinical quadrant.",,,,,,
Sinigrin ,n.) A glucoside found in the seeds of black mustard ,"Brassica nigra, formerly Sinapis nigra) It resembles sinalbin, and consists of a potassium salt of myronic acid.",,,,,
Sinister ,"a.) On the left hand, or the side of the left hand; left; -- opposed to dexter, or right.",,,,,,
Sinister ,"a.) Unlucky; inauspicious; disastrous; injurious; evil; -- the left being usually regarded as the unlucky side; as, sinister influences.",,,,,,
Sinister ,"a.) Wrong, as springing from indirection or obliquity; perverse; dishonest; corrupt; as, sinister aims.",,,,,,
Sinister ,"a.) Indicative of lurking evil or harm; boding covert danger; as, a sinister countenance.",,,,,,
Sinister-handed ,"a.) Left-handed; hence, unlucky.",,,,,,
Sinisterly ,adv.) In a sinister manner.,,,,,,
Sinistrad ,adv.) Toward the left side; sinistrally.,,,,,,
Sinistral ,"a.) Of or pertaining to the left, inclining to the left; sinistrous; -- opposed to dextral.",,,,,,
Sinistral ,a.) Having the whorls of the spire revolving or rising to the left; reversed; -- said of certain spiral shells.,,,,,,
Sinistrality ,n.) The quality or state of being sinistral.,,,,,,
Sinistrally ,adv.) Toward the left; in a sinistral manner.,,,,,,
Sinistrin ,"n.) A mucilaginous carbohydrate, resembling achroodextrin, extracted from squill as a colorless amorphous substance; -- so called because it is levorotatory.",,,,,,
Sinistrorsal ,a.) Rising spirally from right to left ,of the spectator); sinistrorse.,,,,,
Sinistrorse ,a.) Turning to the left ,of the spectator) in the ascending line; -- the opposite of dextrorse. See Dextrorse.,,,,,
Sinistrous ,a.) Being on the left side; inclined to the left; sinistral.,,,,,,
Sinistrous ,a.) Wrong; absurd; perverse.,,,,,,
Sinistrously ,adv.) In a sinistrous manner; perversely; wrongly; unluckily.,,,,,,
Sinistrously ,adv.) With a tendency to use the left hand.,,,,,,
Sunk ,imp.) of Sink,,,,,,
Sank ,) of Sink,,,,,,
Sunk ,p. p.) of Sink,,,,,,
Sunken ,) of Sink,,,,,,
Sinking ,p. pr. & vb. n.) of Sink,,,,,,
Sink ,"v. i.) To fall by, or as by, the force of gravity; to descend lower and lower; to decline gradually; to subside; as, a stone sinks in water; waves rise and sink; the sun sinks in the west.",,,,,,
Sink ,v. i.) To enter deeply; to fall or retire beneath or below the surface; to penetrate.,,,,,,
Sink ,"v. i.) Hence, to enter so as to make an abiding impression; to enter completely.",,,,,,
Sink ,"v. i.) To be overwhelmed or depressed; to fall slowly, as so the ground, from weakness or from an overburden; to fail in strength; to decline; to decay; to decrease.",,,,,,
Sink ,"v. i.) To decrease in volume, as a river; to subside; to become diminished in volume or in apparent height.",,,,,,
Sink ,"v. t.) To cause to sink; to put under water; to immerse or submerge in a fluid; as, to sink a ship.",,,,,,
Sink ,"v. t.) Figuratively: To cause to decline; to depress; to degrade; hence, to ruin irretrievably; to destroy, as by drowping; as, to sink one's reputation.",,,,,,
Sink ,v. t.) To make ,"a depression) by digging, delving, or cutting, etc.; as, to sink a pit or a well; to sink a die.",,,,,
Sink ,v. t.) To bring low; to reduce in quantity; to waste.,,,,,,
Sink ,v. t.) To conseal and appropriate.,,,,,,
Sink ,v. t.) To keep out of sight; to suppress; to ignore.,,,,,,
Sink ,"v. t.) To reduce or extinguish by payment; as, to sink the national debt.",,,,,,
Sink ,n.) A drain to carry off filthy water; a jakes.,,,,,,
Sink ,"n.) A shallow box or vessel of wood, stone, iron, or other material, connected with a drain, and used for receiving filthy water, etc., as in a kitchen.",,,,,,
Sink ,"n.) A hole or low place in land or rock, where waters sink and are lost; -- called also sink hole.",,,,,,
Sinker ,"n.) One who, or that which, sinks.",,,,,,
Sinker ,"n.) A weight on something, as on a fish line, to sink it.",,,,,,
Sinker ,"n.) In knitting machines, one of the thin plates, blades, or other devices, that depress the loops upon or between the needles.",,,,,,
Sinking ,) a. & n. from Sink.,,,,,,
Sinless ,a.) Free from sin.,,,,,,
Sinner ,"n.) One who has sinned; especially, one who has sinned without repenting; hence, a persistent and incorrigible transgressor; one condemned by the law of God.",,,,,,
Sinner ,v. i.) To act as a sinner.,,,,,,
Sinneress ,n.) A woman who sins.,,,,,,
Sinnet ,n.) See Sennit .,,,,,,
Sinological ,a.) Relating to the Chinese language or literature.,,,,,,
Sinologist ,n.) A sinologue.,,,,,,
Sinologue ,"n.) A student of Chinese; one versed in the Chinese language, literature, and history.",,,,,,
Sinology ,"n.) That branch of systemized knowledge which treats of the Chinese, their language, literature, etc.",,,,,,
Sinoper ,n.) Sinople.,,,,,,
Sinopia ,n.) Alt. of Sinopis,,,,,,
Sinopis ,n.) A red pigment made from sinopite.,,,,,,
Sinopite ,n.) A brickred ferruginous clay used by the ancients for red paint.,,,,,,
Sinople ,"n.) Ferruginous quartz, of a blood-red or brownish red color, sometimes with a tinge of yellow.",,,,,,
Sinople ,n.) The tincture vert; green.,,,,,,
Sinque ,n.) See Cinque.,,,,,,
Sinsring ,n.) Same as Banxring.,,,,,,
Sinter ,"n.) Dross, as of iron; the scale which files from iron when hammered; -- applied as a name to various minerals.",,,,,,
Sinto ,) Alt. of Sintoist,,,,,,
Sintu ,) Alt. of Sintoist,,,,,,
Sintoism ,) Alt. of Sintoist,,,,,,
Sintoist ,") See Shinto, etc.",,,,,,
Sintoc ,"n.) A kind of spice used in the East Indies, consisting of the bark of a species of Cinnamomum.",,,,,,
Siniate ,a.) Having the margin alternately curved inward and outward; having rounded lobes separated by rounded sinuses; sinuous; wavy.,,,,,,
Sinuated ,imp. & p. p.) of Sinuate,,,,,,
Sinuating ,p. pr. & vb. n.) of Sinuate,,,,,,
Sinuate ,v. i.) To bend or curve in and out; to wind; to turn; to be sinusous.,,,,,,
Sinuated ,a.) Same as Sinuate.,,,,,,
Sinuation ,n.) A winding or bending in and out.,,,,,,
Sinuose ,a.) Sinuous.,,,,,,
Sinuosities ,pl. ) of Sinuosity,,,,,,
Sinuosity ,n.) Quality or state of being sinuous.,,,,,,
Sinuosity ,"n.) A bend, or a series of bends and turns; a winding, or a series of windings; a wave line; a curve.",,,,,,
Sinuous ,a.) Bending in and out; of a serpentine or undulating form; winding; crooked.,,,,,,
Sinupalliate ,a.) Having a pallial sinus. See under Sinus.,,,,,,
Sinus ,pl. ) of Sinus,,,,,,
Sinuses ,pl. ) of Sinus,,,,,,
Sinus ,n.) An opening; a hollow; a bending.,,,,,,
Sinus ,n.) A bay of the sea; a recess in the shore.,,,,,,
Sinus ,n.) A cavity; a depression.,,,,,,
Sinus ,"n.) A cavity in a bone or other part, either closed or with a narrow opening.",,,,,,
Sinus ,n.) A dilated vessel or canal.,,,,,,
Sinus ,"n.) A narrow, elongated cavity, in which pus is collected; an elongated abscess with only a small orifice.",,,,,,
Sinus ,n.) A depression between adjoining lobes.,,,,,,
Sinusoid ,"n.) The curve whose ordinates are proportional to the sines of the abscissas, the equation of the curve being y = a sin x. It is also called the curve of sines.",,,,,,
Sinusoidal ,a.) Of or pertaining to a sinusoid; like a sinusoid.,,,,,,
Siogoon ,n.) See Shogun.,,,,,,
Siogoonate ,n.) See Shogunate.,,,,,,
Sioux ,n. sing. & pl.) See Dakotas.,,,,,,
Sipped ,imp. & p. p.) of Sip,,,,,,
Sipping ,p. pr. & vb. n.) of Sip,,,,,,
Sip ,"v. t.) To drink or imbibe in small quantities; especially, to take in with the lips in small quantities, as a liquid; as, to sip tea.",,,,,,
Sip ,"v. t.) To draw into the mouth; to suck up; as, a bee sips nectar from the flowers.",,,,,,
Sip ,v. t.) To taste the liquor of; to drink out of.,,,,,,
Sip ,v. i.) To drink a small quantity; to take a fluid with the lips; to take a sip or sips of something.,,,,,,
Sip ,n.) The act of sipping; the taking of a liquid with the lips.,,,,,,
Sip ,n.) A small draught taken with the lips; a slight taste.,,,,,,
Sipage ,n.) See Seepage.,,,,,,
Sip ,v. i.) See Seep.,,,,,,
Siphilis ,n.) Syphilis.,,,,,,
Siphoid ,"n.) A siphon bottle. See under Siphon, n.",,,,,,
Siphon ,"n.) A device, consisting of a pipe or tube bent so as to form two branches or legs of unequal length, by which a liquid can be transferred to a lower level, as from one vessel to another, over an intermediate elevation, by the action of the pressure of the atmosphere in forcing the liquid up the shorter branch of the pipe immersed in it, while the continued excess of weight of the liquid in the longer branch ","when once filled) causes a continuous flow. The flow takes place only when the discharging extremity of the pipe ia lower than the higher liquid surface, and when no part of the pipe is higher above the surface than the same liquid will rise by atmospheric pressure; that is, about 33 feet for water, and 30 inches for mercury, near the sea level.",,,,,
Siphon ,"n.) One of the tubes or folds of the mantle border of a bivalve or gastropod mollusk by which water is conducted into the gill cavity. See Illust. under Mya, and Lamellibranchiata.",,,,,,
Siphon ,n.) The anterior prolongation of the margin of any gastropod shell for the protection of the soft siphon.,,,,,,
Siphon ,"n.) The tubular organ through which water is ejected from the gill cavity of a cephaloid. It serves as a locomotive organ, by guiding and confining the jet of water. Called also siphuncle. See Illust. under Loligo, and Dibranchiata.",,,,,,
Siphon ,n.) The siphuncle of a cephalopod shell.,,,,,,
Siphon ,n.) The sucking proboscis of certain parasitic insects and crustaceans.,,,,,,
Siphon ,n.) A sproutlike prolongation in front of the mouth of many gephyreans.,,,,,,
Siphon ,n.) A tubular organ connected both with the esophagus and the intestine of certain sea urchins and annelids.,,,,,,
Siphon ,n.) A siphon bottle.,,,,,,
Siphon ,"v. t.) To convey, or draw off, by means of a siphon, as a liquid from one vessel to another at a lower level.",,,,,,
Siphonage ,n.) The action of a siphon.,,,,,,
Siphonal ,a.) Of or pertaining to a siphon; resembling a siphon.,,,,,,
Siphonarid ,n.) Any one of numerous species of limpet-shaped pulmonate gastropods of the genus Siphonaria. They cling to rocks between high and low water marks and have both lunglike organs and gills.,,,,,,
Siphonata ,"n. pl.) A tribe of bivalve mollusks in which the posterior mantle border is prolonged into two tubes or siphons. Called also Siphoniata. See Siphon, 2 ","a), and Quahaug.",,,,,
Siphonate ,a.) Having a siphon or siphons.,,,,,,
Siphonate ,a.) Belonging to the Siphonata.,,,,,,
Siphonet ,n.) One of the two dorsal tubular organs on the hinder part of the abdomen of aphids. They give exit to the honeydew. See Illust. under Aphis.,,,,,,
Siphonia ,n.) A former name for a euphorbiaceous genus ,"Hevea) of South American trees, the principal source of caoutchouc.",,,,,
Siphoniata ,n. pl.) Same as Siphonata.,,,,,,
Siphonic ,a.) Of or pertaining to a siphon.,,,,,,
Siphonifer ,n.) Any cephalopod having a siphonate shell.,,,,,,
Siphoniferous ,"a.) Siphon-bearing, as the shell of the nautilus and other cephalopods.",,,,,,
Siphonia ,pl. ) of Siphonium,,,,,,
Siphonium ,"n.) A bony tube which, in some birds, connects the tympanium with the air chambers of the articular piece of the mandible.",,,,,,
Siphonobranchiata ,"n. pl.) A tribe of gastropods having the mantle border, on one or both sides, prolonged in the form of a spout through which water enters the gill cavity. The shell itself is not always siphonostomatous in this group.",,,,,,
Siphonobranchiate ,"a.) Having a siphon, or siphons, to convey water to the gills; belonging or pertaining to the Siphonobranchiata.",,,,,,
Siphonobranchiate ,n.) One of the Siphonobranchiata.,,,,,,
Siphonoglyphe ,n.) A gonidium.,,,,,,
Siphonophora ,"n. pl.) An order of pelagic Hydrozoa including species which form complex free-swimming communities composed of numerous zooids of various kinds, some of which act as floats or as swimming organs, others as feeding or nutritive zooids, and others as reproductive zooids. See Illust. under Physallia, and Porpita.",,,,,,
Siphonophoran ,a.) Belonging to the Siphonophora.,,,,,,
Siphonophoran ,n.) One of the Siphonophora.,,,,,,
Siphonophore ,n.) One of the Siphonophora.,,,,,,
Siphonopoda ,n. pl.) A division of Scaphopoda including those in which the foot terminates in a circular disk.,,,,,,
Siphonostomata ,"n. pl.) A tribe of parasitic copepod Crustacea including a large number of species that are parasites of fishes, as the lerneans. They have a mouth adapted to suck blood.",,,,,,
Siphonostomata ,n. pl.) An artificial division of gastropods including those that have siphonostomatous shells.,,,,,,
Siphonostomatous ,a.) Having the front edge of the aperture of the shell prolonged in the shape of a channel for the protection of the siphon; -- said of certain gastropods.,,,,,,
Siphonostomatous ,a.) Pertaining to the Siphonostomata.,,,,,,
Siphonostome ,n.) Any parasitic entomostracan of the tribe Siphonostomata.,,,,,,
Siphonostome ,n.) A siphonostomatous shell.,,,,,,
Siphorhinal ,"a.) Having tubular nostrils, as the petrels.",,,,,,
Siphorhinian ,n.) A siphorhinal bird.,,,,,,
Siphuncle ,n.) The tube which runs through the partitions of chambered cephalopod shells.,,,,,,
Siphuncled ,a.) Having a siphuncle; siphunculated.,,,,,,
Siphuncular ,a.) Of or pertaining to the siphuncle.,,,,,,
Siphunculated ,a.) Having a siphuncle.,,,,,,
Sipid ,a.) Having a taste or flavorl savory; sapid.,,,,,,
Sipper ,n.) One whi sips.,,,,,,
Sippet ,"n.) A small sop; a small, thin piece of toasted bread soaked in milk, broth, or the like; a small piece of toasted or fried bread cut into some special shape and used for garnishing.",,,,,,
Sipple ,v. i.) To sip often.,,,,,,
Sippling ,a.) Sipping often.,,,,,,
Sipunculacea ,"n. pl.) A suborder of Gephyrea, including those which have the body unarmed and the intestine opening anteriorly.",,,,,,
Sipunculoid ,a.) Pertaining to the Sipunculoidea.,,,,,,
Sipunculoid ,n.) One of the Sipunculoidea.,,,,,,
Sipunculoidea ,n. pl.) Same as Gephyrea.,,,,,,
Sipunculoidea ,"n. pl.) In a restricted sense, same as Sipunculacea.",,,,,,
Si quis ,) A notification by a candidate for orders of his intention to inquire whether any impediment may be alleged against him.,,,,,,
Sir ,n.) A man of social authority and dignity; a lord; a master; a gentleman; -- in this sense usually spelled sire.,,,,,,
Sir ,n.) A title prefixed to the Christian name of a knight or a baronet.,,,,,,
Sir ,"n.) An English rendering of the LAtin Dominus, the academical title of a bachelor of arts; -- formerly colloquially, and sometimes contemptuously, applied to the clergy.",,,,,,
Sir ,"n.) A respectful title, used in addressing a man, without being prefixed to his name; -- used especially in speaking to elders or superiors; sometimes, also, used in the way of emphatic formality.",,,,,,
Siraskier ,n.) See Seraskier.,,,,,,
Siraskierate ,n.) See Seraskierate.,,,,,,
Sirbonian ,a.) See Serbonian.,,,,,,
Sircar ,n.) A Hindoo clerk or accountant.,,,,,,
Sircar ,n.) A district or province; a circar.,,,,,,
Sircar ,n.) The government; the supreme authority of the state.,,,,,,
Sirdar ,n.) A native chief in Hindostan; a headman.,,,,,,
Sire ,"n.) A lord, master, or other person in authority. See Sir.",,,,,,
Sire ,"n.) A tittle of respect formerly used in speaking to elders and superiors, but now only in addressing a sovereign.",,,,,,
Sire ,n.) A father; the head of a family; the husband.,,,,,,
Sire ,n.) A creator; a maker; an author; an originator.,,,,,,
Sire ,"n.) The male parent of a beast; -- applied especially to horses; as, the horse had a good sire.",,,,,,
Sired ,imp. & p. p.) of Sire,,,,,,
Siring ,p. pr. & vb. n.) of Sire,,,,,,
Sire ,"v. t.) To beget; to procreate; -- used of beasts, and especially of stallions.",,,,,,
Siredon ,"n.) The larval form of any salamander while it still has external gills; especially, one of those which, like the axolotl ","Amblystoma Mexicanum), sometimes lay eggs while in this larval state, but which under more favorable conditions lose their gills and become normal salamanders. See also Axolotl.",,,,,
Siren ,"n.) One of three sea nymphs, -- or, according to some writers, of two, -- said to frequent an island near the coast of Italy, and to sing with such sweetness that they lured mariners to destruction.",,,,,,
Siren ,"n.) An enticing, dangerous woman.",,,,,,
Siren ,n.) Something which is insidious or deceptive.,,,,,,
Siren ,n.) A mermaid.,,,,,,
Siren ,"n.) Any long, slender amphibian of the genus Siren or family Sirenidae, destitute of hind legs and pelvis, and having permanent external gills as well as lungs. They inhabit the swamps, lagoons, and ditches of the Southern United States. The more common species ","Siren lacertina) is dull lead-gray in color, and becames two feet long.",,,,,
Siren ,n.) An instrument for producing musical tones and for ascertaining the number of sound waves or vibrations per second which produce a note of a given pitch. The sounds are produced by a perforated rotating disk or disks. A form with two disks operated by steam or highly compressed air is used sounding an alarm to vessels in fog.,,,,,,
Siren ,"a.) Of or pertaining to a siren; bewitching, like a siren; fascinating; alluring; as, a siren song.",,,,,,
Sirene ,"n.) See Siren, 6.",,,,,,
Sirenia ,"n. pl.) An order of large aquatic herbivorous mammals, including the manatee, dugong, rytina, and several fossil genera.",,,,,,
Sirenian ,n.) Any species of Sirenia.,,,,,,
Sirenical ,"a.) Like, or appropriate to, a siren; fascinating; deceptive.",,,,,,
Sirenize ,v. i.) To use the enticements of a siren; to act as a siren; to fascinate.,,,,,,
Siriasis ,n.) A sunstroke.,,,,,,
Siriasis ,n.) The act of exposing to a sun bath. [Obs.] Cf. Insolation.,,,,,,
Sirius ,n.) The Dog Star. See Dog Star.,,,,,,
Sirkeer ,"n.) Any one of several species of Asiatic cuckoos of the genus Taccocua, as the Bengal sirkeer ",T. sirkee).,,,,,
Sirloin ,"n.) A loin of beef, or a part of a loin.",,,,,,
Sirname ,n.) See Surname.,,,,,,
Siroc ,n.) See Sirocco.,,,,,,
Siroccos ,pl. ) of Sirocco,,,,,,
Sirocco ,"n.) An oppressive, relaxing wind from the Libyan deserts, chiefly experienced in Italy, Malta, and Sicily.",,,,,,
Sirrah ,"n.) A term of address implying inferiority and used in anger, contempt, reproach, or disrespectful familiarity, addressed to a man or boy, but sometimes to a woman. In sililoquies often preceded by ah. Not used in the plural.",,,,,,
Sirt ,n.) A quicksand.,,,,,,
Sirup ,n.) Alt. of Syrup,,,,,,
Syrup ,"n.) A thick and viscid liquid made from the juice of fruits, herbs, etc., boiled with sugar.",,,,,,
Syrup ,n.) A thick and viscid saccharine solution of superior quality ,"as sugarhouse sirup or molasses, maple sirup); specifically, in pharmacy and often in cookery, a saturated solution of sugar and water ","simple sirup), or such a solution flavored or medicated.",,,,
Siruped ,a.) Alt. of Syruped,,,,,,
Syruped ,"a.) Moistened, covered, or sweetened with sirup, or sweet juice.",,,,,,
Sirupy ,a.) Alt. of Syrupy,,,,,,
Syrupy ,"a.) Like sirup, or partaking of its qualities.",,,,,,
Sirvente ,"n.) A peculiar species of poetry, for the most part devoted to moral and religious topics, and commonly satirical, -- often used by the troubadours of the Middle Ages.",,,,,,
Sis ,n.) A colloquial abbreviation of Sister.,,,,,,
Sis ,n.) Six. See Sise.,,,,,,
Sisal grass ,) Alt. of Sisal hemp,,,,,,
Sisal hemp ,") The prepared fiber of the Agave Americana, or American aloe, used for cordage; -- so called from Sisal, a port in Yucatan. See Sisal hemp, under Hemp.",,,,,,
Siscowet ,"n.) A large, fat variety of the namaycush found in Lake Superior; -- called also siskawet, siskiwit.",,,,,,
Sise ,n.) An assize.,,,,,,
Sise ,n.) Six; the highest number on a die; the cast of six in throwing dice.,,,,,,
Sisel ,n.) The suslik.,,,,,,
Siser ,n.) Cider. See Sicer.,,,,,,
Siserara ,n.) Alt. of Siserary,,,,,,
Siserary ,n.) A hard blow.,,,,,,
Siskin ,n.) A small green and yellow European finch ,"Spinus spinus, or Carduelis spinus); -- called also aberdevine.",,,,,
Siskin ,n.) The American pinefinch ,S. pinus); -- called also pine siskin. See Pinefinch.,,,,,
Siskiwit ,n.) The siscowet.,,,,,,
Sismograph ,n.) See Seismograph.,,,,,,
Sismometer ,n.) See Seismometer.,,,,,,
Siss ,"v. i.) To make a hissing sound; as, a flatiron hot enough to siss when touched with a wet finger.",,,,,,
Siss ,n.) A hissing noise.,,,,,,
Sissoo ,n.) A leguminous tree ,"Dalbergia Sissoo) of the northern parts of India; also, the dark brown compact and durable timber obtained from it. It is used in shipbuilding and for gun carriages, railway ties, etc.",,,,,
Sist ,"v. t.) To stay, as judicial proceedings; to delay or suspend; to stop.",,,,,,
Sist ,"v. t.) To cause to take a place, as at the bar of a court; hence, to cite; to summon; to bring into court.",,,,,,
Sist ,n.) A stay or suspension of proceedings; an order for a stay of proceedings.,,,,,,
Sister ,"n.) A female who has the same parents with another person, or who has one of them only. In the latter case, she is more definitely called a half sister. The correlative of brother.",,,,,,
Sister ,"n.) A woman who is closely allied to, or assocciated with, another person, as in the sdame faith, society, order, or community.",,,,,,
Sister ,"n.) One of the same kind, or of the same condition; -- generally used adjectively; as, sister fruits.",,,,,,
Sister ,v. t.) To be sister to; to resemble closely.,,,,,,
Sisterhood ,n.) The state or relation of being a sister; the office or duty of a sister.,,,,,,
Sisterhood ,"n.) A society of sisters; a society of women united in one faith or order; sisters, collectively.",,,,,,
Sistering ,a.) Contiguous.,,,,,,
Sisters-in-law ,pl. ) of Sister-in-law,,,,,,
Sister-in-law ,"n.) The sister of one's husband or wife; also, the wife of one's brother; sometimes, the wife of one's husband's or wife's brother.",,,,,,
Sisterly ,"a.) Like a sister; becoming a sister, affectionate; as, sisterly kindness; sisterly remorse.",,,,,,
Sistine ,a.) Of or pertaining to Pope Sixtus.,,,,,,
Sistren ,n. pl.) Sisters.,,,,,,
Sistrum ,") An instrument consisting of a thin metal frame, through which passed a number of metal rods, and furnished with a handle by which it was shaken and made to rattle. It was peculiarly Egyptian, and used especially in the worship of Isis. It is still used in Nubia.",,,,,,
