Amolika,Priceless
Classically ,adv.) In a classical manner; according to the manner of classical authors.,,,,,,
Classically ,adv.) In the manner of classes; according to a regular order of classes or sets.,,,,,,
Classicism ,n.) A classic idiom or expression; a classicalism.,,,,,,
Classicist ,n.) One learned in the classics; an advocate for the classics.,,,,,,
Classifiable ,a.) Capable of being classified.,,,,,,
Classific ,a.) Characterizing a class or classes; relating to classification.,,,,,,
Classification ,"n.) The act of forming into a class or classes; a distibution into groups, as classes, orders, families, etc., according to some common relations or affinities.",,,,,,
Classificatory ,a.) Pertaining to classification; admitting of classification.,,,,,,
Classifier ,n.) One who classifies.,,,,,,
Classified ,imp. & pp.) of Classify,,,,,,
Classifying ,p. pr. & vb. n.) of Classify,,,,,,
Classify ,v. t.) To distribute into classes; to arrange according to a system; to arrange in sets according to some method founded on common properties or characters.,,,,,,
Classes ,pl. ) of Classis,,,,,,
Classis ,n.) A class or order; sort; kind.,,,,,,
Classis ,"n.) An ecclesiastical body or judicatory in certain churches, as the Reformed Dutch. It is intermediate between the consistory and the synod, and corresponds to the presbytery in the Presbyterian church.",,,,,,
Classmen ,pl. ) of Classman,,,,,,
Classman ,n.) A member of a class; a classmate.,,,,,,
Classman ,"n.) A candidate for graduation in arts who is placed in an honor class, as opposed to a passman, who is not classified.",,,,,,
Classmate ,"n.) One who is in the same class with another, as at school or college.",,,,,,
Clastic ,"a.) Pertaining to what may be taken apart; as, clastic anatomy ",of models).,,,,,
Clastic ,"a.) Fragmental; made up of brok/ fragments; as, sandstone is a clastic rock.",,,,,,
Clathrate ,a.) Shaped like a lattice; cancellate.,,,,,,
Clathrate ,"a.) Having the surface marked with raised lines resembling a lattice, as many shells.",,,,,,
Clattered ,imp. & p. p.) of Clatter,,,,,,
Clattering ,p. pr. & vb. n.) of Clatter,,,,,,
Clatter ,"v. i.) To make a rattling sound by striking hard bodies together; to make a succession of abrupt, rattling sounds.",,,,,,
Clatter ,v. i.) To talk fast and noisily; to rattle with the tongue.,,,,,,
Clatter ,v. t.) To make a rattling noise with.,,,,,,
Clatter ,"n.) A rattling noise, esp. that made by the collision of hard bodies; also, any loud, abrupt sound; a repetition of abrupt sounds.",,,,,,
Clatter ,n.) Commotion; disturbance.,,,,,,
Clatter ,"n.) Rapid, noisy talk; babble; chatter.",,,,,,
Clatterer ,n.) One who clatters.,,,,,,
Clatteringly ,adv.) With clattering.,,,,,,
Claude Lorraine glass ,") A slightly convex mirror, commonly of black glass, used as a toy for viewing the reflected landscape.",,,,,,
Claudent ,"a.) Shutting; confining; drawing together; as, a claudent muscle.",,,,,,
Claudicant ,a.) Limping.,,,,,,
Claudication ,n.) A halting or limping.,,,,,,
Clause ,"n.) A separate portion of a written paper, paragraph, or sentence; an article, stipulation, or proviso, in a legal document.",,,,,,
Clause ,n.) A subordinate portion or a subdivision of a sentence containing a subject and its predicate.,,,,,,
Clause ,"n.) See Letters clause / close, under Letter.",,,,,,
Claustral ,a.) Cloistral.,,,,,,
Claustra ,pl. ) of Claustrum,,,,,,
Claustrum ,n.) A thin lamina of gray matter in each cerebral hemisphere of the brain of man.,,,,,,
Clausular ,"n.) Consisting of, or having, clauses.",,,,,,
Clausure ,n.) The act of shutting up or confining; confinement.,,,,,,
Clavate ,a.) Alt. of Clavated,,,,,,
Clavated ,a.) Club-shaped; having the form of a club; growing gradually thicker toward the top. [See Illust. of Antennae.],,,,,,
Clave ,) imp. of Cleave.,,,,,,
Clavecin ,n.) The harpsichord.,,,,,,
Clavel ,n.) See Clevis.,,,,,,
Clavellate ,a.) See Clavate.,,,,,,
Clavellated ,"a.) Said of potash, probably in reference to its having been obtained from billets of wood by burning.",,,,,,
Claver ,n.) See Clover.,,,,,,
Claver ,n.) Frivolous or nonsensical talk; prattle; chattering.,,,,,,
Clavichord ,"n.) A keyed stringed instrument, now superseded by the pianoforte. See Clarichord.",,,,,,
Clavicle ,"n.) The collar bone, which is joined at one end to the scapula, or shoulder blade, and at the other to the sternum, or breastbone. In man each clavicle is shaped like the letter /, and is situated just above the first rib on either side of the neck. In birds the two clavicles are united ventrally, forming the merrythought, or wishbone.",,,,,,
Clavicorn ,a.) Having club-shaped antennae. See Antennae,,,,,,
Clavicorn ,n.) One of the Clavicornes.,,,,,,
Clavicornes ,n. pl.) A group of beetles having club-shaped antennae.,,,,,,
Clavicular ,a.) Of or pertaining to the clavicle.,,,,,,
Clavier ,"n.) The keyboard of an organ, pianoforte, or harmonium.",,,,,,
Claviform ,a.) Club-shaped; clavate.,,,,,,
Claviger ,n.) One who carries the keys of any place.,,,,,,
Claviger ,n.) One who carries a club; a club bearer.,,,,,,
Clavigerous ,a.) Bearing a club or a key.,,,,,,
Claves ,pl. ) of Clavis,,,,,,
Clavises ,pl. ) of Clavis,,,,,,
Clavis ,n.) A key; a glossary.,,,,,,
Clavus ,"n.) A callous growth, esp. one the foot; a corn.",,,,,,
Clavies ,pl. ) of Clavy,,,,,,
Clavy ,n.) A mantelpiece.,,,,,,
Claw ,"n.) A sharp, hooked nail, as of a beast or bird.",,,,,,
Claw ,"n.) The whole foot of an animal armed with hooked nails; the pinchers of a lobster, crab, etc.",,,,,,
Claw ,"n.) Anything resembling the claw of an animal, as the curved and forked end of a hammer for drawing nails.",,,,,,
Claw ,"n.) A slender appendage or process, formed like a claw, as the base of petals of the pink.",,,,,,
Clawed ,imp. & p. p.) of Claw,,,,,,
Clawing ,p. pr. & vb. n.) of Claw,,,,,,
Claw ,"n.) To pull, tear, or scratch with, or as with, claws or nails.",,,,,,
Claw ,"n.) To relieve from some uneasy sensation, as by scratching; to tickle; hence, to flatter; to court.",,,,,,
Claw ,n.) To rail at; to scold.,,,,,,
Claw ,"v. i.) To scrape, scratch, or dig with a claw, or with the hand as a claw.",,,,,,
Clawback ,n.) A flatterer or sycophant.,,,,,,
Clawback ,a.) Flattering; sycophantic.,,,,,,
Clawback ,v. t.) To flatter.,,,,,,
Clawed ,a.) Furnished with claws.,,,,,,
Clawless ,a.) Destitute of claws.,,,,,,
Clay ,"n.) A soft earth, which is plastic, or may be molded with the hands, consisting of hydrous silicate of aluminium. It is the result of the wearing down and decomposition, in part, of rocks containing aluminous minerals, as granite. Lime, magnesia, oxide of iron, and other ingredients, are often present as impurities.",,,,,,
Clay ,"n.) Earth in general, as representing the elementary particles of the human body; hence, the human body as formed from such particles.",,,,,,
Clayed ,imp. & p. p.) of Clay,,,,,,
Claying ,p. pr. & vb. n.) of Clay,,,,,,
Clay ,v. t.) To cover or manure with clay.,,,,,,
Clay ,"v. t.) To clarify by filtering through clay, as sugar.",,,,,,
Clay-brained ,a.) Stupid.,,,,,,
Clayes ,"n. pl.) Wattles, or hurdles, made with stakes interwoven with osiers, to cover lodgments.",,,,,,
Clayey ,a.) Consisting of clay; abounding with clay; partaking of clay; like clay.,,,,,,
Clayish ,"a.) Partaking of the nature of clay, or containing particles of it.",,,,,,
Claymore ,n.) A large two-handed sword used formerly by the Scottish Highlanders.,,,,,,
Claytonia ,n.) An American genus of perennial herbs with delicate blossoms; -- sometimes called spring beauty.,,,,,,
Cleading ,"n.) A jacket or outer covering of wood, etc., to prevent radiation of heat, as from the boiler, cylinder. etc., of a steam engine.",,,,,,
Cleading ,"n.) The planking or boarding of a shaft, cofferdam, etc.",,,,,,
Clean ,"superl.) Free from dirt or filth; as, clean clothes.",,,,,,
Clean ,"superl.) Free from that which is useless or injurious; without defects; as, clean land; clean timber.",,,,,,
Clean ,"superl.) Free from awkwardness; not bungling; adroit; dexterous; as, aclean trick; a clean leap over a fence.",,,,,,
Clean ,"superl.) Free from errors and vulgarisms; as, a clean style.",,,,,,
Clean ,superl.) Free from restraint or neglect; complete; entire.,,,,,,
Clean ,superl.) Free from moral defilement; sinless; pure.,,,,,,
Clean ,superl.) Free from ceremonial defilement.,,,,,,
Clean ,superl.) Free from that which is corrupting to the morals; pure in tone; healthy.,,,,,,
Clean ,"superl.) Well-proportioned; shapely; as, clean limbs.",,,,,,
Clean ,adv.) Without limitation or remainder; quite; perfectly; wholly; entirely.,,,,,,
Clean ,adv.) Without miscarriage; not bunglingly; dexterously.,,,,,,
Cleaned ,imp. & p. p.) of Clean,,,,,,
Cleaning ,p. pr. & vb. n.) of Clean,,,,,,
Clean ,"a.) To render clean; to free from whatever is foul, offensive, or extraneous; to purify; to cleanse.",,,,,,
Clean-cut ,a.) See Clear-cut.,,,,,,
Cleaner ,"n.) One who, or that which, cleans.",,,,,,
Cleaning ,n.) The act of making clean.,,,,,,
Cleaning ,"n.) The afterbirth of cows, ewes, etc.",,,,,,
Cleanlily ,adv.) In a cleanly manner.,,,,,,
Clean-limbed ,"a.) With well-proportioned, unblemished limbs; as, a clean-limbed young fellow.",,,,,,
Cleanliness ,n.) State of being cleanly; neatness of person or dress.,,,,,,
Cleanly ,superl.) Habitually clean; pure; innocent.,,,,,,
Cleanly ,"superl.) Cleansing; fitted to remove moisture; dirt, etc.",,,,,,
Cleanly ,superl.) Adroit; skillful; dexterous; artful.,,,,,,
Cleanly ,adv.) In a clean manner; neatly.,,,,,,
Cleanly ,adv.) Innocently; without stain.,,,,,,
Cleanly ,adv.) Adroitly; dexterously.,,,,,,
Cleanness ,n.) The state or quality of being clean.,,,,,,
Cleanness ,n.) Purity of life or language; freedom from licentious courses.,,,,,,
Cleansable ,a.) Capable of being cleansed.,,,,,,
Cleansed ,imp. & p. p.) of Cleanse,,,,,,
Cleansing ,p. pr. & vb. n.) of Cleanse,,,,,,
Cleanse ,"v. t.) To render clean; to free from fith, pollution, infection, guilt, etc.; to clean.",,,,,,
Cleanser ,"n.) One who, or that which, cleanses; a detergent.",,,,,,
Clean-timbered ,a.) Well-proportioned; symmetrical.,,,,,,
Clear ,superl.) Free from opaqueness; transparent; bright; light; luminous; unclouded.,,,,,,
Clear ,superl.) Free from ambiguity or indistinctness; lucid; perspicuous; plain; evident; manifest; indubitable.,,,,,,
Clear ,"superl.) Able to perceive clearly; keen; acute; penetrating; discriminating; as, a clear intellect; a clear head.",,,,,,
Clear ,superl.) Not clouded with passion; serene; cheerful.,,,,,,
Clear ,superl.) Easily or distinctly heard; audible; canorous.,,,,,,
Clear ,"superl.) Without mixture; entirely pure; as, clear sand.",,,,,,
Clear ,"superl.) Without defect or blemish, such as freckles or knots; as, a clear complexion; clear lumber.",,,,,,
Clear ,superl.) Free from guilt or stain; unblemished.,,,,,,
Clear ,"superl.) Without diminution; in full; net; as, clear profit.",,,,,,
Clear ,"superl.) Free from impediment or obstruction; unobstructed; as, a clear view; to keep clear of debt.",,,,,,
Clear ,"superl.) Free from embarrassment; detention, etc.",,,,,,
Clear ,"n.) Full extent; distance between extreme limits; especially; the distance between the nearest surfaces of two bodies, or the space between walls; as, a room ten feet square in the clear.",,,,,,
Clear ,adv.) In a clear manner; plainly.,,,,,,
Clear ,"adv.) Without limitation; wholly; quite; entirely; as, to cut a piece clear off.",,,,,,
Cleared ,imp. & p. p.) of Clear,,,,,,
Clearing ,p. pr. & vb. n.) of Clear,,,,,,
Clear ,"v. t.) To render bright, transparent, or undimmed; to free from clouds.",,,,,,
Clear ,v. t.) To free from impurities; to clarify; to cleanse.,,,,,,
Clear ,v. t.) To free from obscurity or ambiguity; to relive of perplexity; to make perspicuous.,,,,,,
Clear ,"v. t.) To render more quick or acute, as the understanding; to make perspicacious.",,,,,,
Clear ,"v. t.) To free from impediment or incumbrance, from defilement, or from anything injurious, useless, or offensive; as, to clear land of trees or brushwood, or from stones; to clear the sight or the voice; to clear one's self from debt; -- often used with of, off, away, or out.",,,,,,
Clear ,"v. t.) To free from the imputation of guilt; to justify, vindicate, or acquit; -- often used with from before the thing imputed.",,,,,,
Clear ,"v. t.) To leap or pass by, or over, without touching or failure; as, to clear a hedge; to clear a reef.",,,,,,
Clear ,v. t.) To gain without deduction; to net.,,,,,,
Clear ,"v. i.) To become free from clouds or fog; to become fair; -- often followed by up, off, or away.",,,,,,
Clear ,"v. i.) To disengage one's self from incumbrances, distress, or entanglements; to become free.",,,,,,
Clear ,"v. i.) To make exchanges of checks and bills, and settle balances, as is done in a clearing house.",,,,,,
Clear ,"v. i.) To obtain a clearance; as, the steamer cleared for Liverpool to-day.",,,,,,
Clearage ,n.) The act of removing anything; clearance.,,,,,,
Clearance ,"n.) The act of clearing; as, to make a thorough clearance.",,,,,,
Clearance ,n.) A certificate that a ship or vessel has been cleared at the customhouse; permission to sail.,,,,,,
Clearance ,n.) Clear or net profit.,,,,,,
Clearance ,"n.) The distance by which one object clears another, as the distance between the piston and cylinder head at the end of a stroke in a steam engine, or the least distance between the point of a cogwheel tooth and the bottom of a space between teeth of a wheel with which it engages.",,,,,,
Clear-cut ,"a.) Having a sharp, distinct outline, like that of a cameo.",,,,,,
Clear-cut ,a.) Concisely and distinctly expressed.,,,,,,
Clearedness ,n.) The quality of being cleared.,,,,,,
Clearer ,"n.) One who, or that which, clears.",,,,,,
Clearer ,"n.) A tool of which the hemp for lines and twines, used by sailmakers, is finished.",,,,,,
Clear-headed ,a.) Having a clear understanding; quick of perception; intelligent.,,,,,,
Clearing ,n.) The act or process of making clear.,,,,,,
Clearing ,n.) A tract of land cleared of wood for cultivation.,,,,,,
Clearing ,"n.) A method adopted by banks and bankers for making an exchange of checks held by each against the others, and settling differences of accounts.",,,,,,
Clearing ,n.) The gross amount of the balances adjusted in the clearing house.,,,,,,
Clearly ,adv.) In a clear manner.,,,,,,
Clearness ,n.) The quality or state of being clear.,,,,,,
Clear-seeing ,a.) Having a clear physical or mental vision; having a clear understanding.,,,,,,
Clear-shining ,a.) Shining brightly.,,,,,,
Clear-sighted ,"a.) Seeing with clearness; discerning; as, clear-sighted reason",,,,,,
Clear-sightedness ,n.) Acute discernment.,,,,,,
Clearstarched ,imp. & p. p.) of Clearstarch,,,,,,
Clearstraching ,p. pr. & vb. n.) of Clearstarch,,,,,,
Clearstarch ,"v. t.) To stiffen with starch, and then make clear by clapping with the hands; as, to clearstarch muslin.",,,,,,
Clearstarcher ,n.) One who clearstarches.,,,,,,
Clearstory ,n.) Alt. of Clerestory,,,,,,
Clerestory ,"n.) The upper story of the nave of a church, containing windows, and rising above the aisle roofs.",,,,,,
Clearwing ,"n.) A lepidopterous insect with partially transparent wings, of the family Aegeriadae, of which the currant and peach-tree borers are examples.",,,,,,
Cleat ,"n.) A strip of wood or iron fastened on transversely to something in order to give strength, prevent warping, hold position, etc.",,,,,,
Cleat ,"n.) A device made of wood or metal, having two arms, around which turns may be taken with a line or rope so as to hold securely and yet be readily released. It is bolted by the middle to a deck or mast, etc., or it may be lashed to a rope.",,,,,,
Cleat ,v. t.) To strengthen with a cleat.,,,,,,
Cleavable ,a.) Capable of cleaving or being divided.,,,,,,
Cleavage ,n.) The act of cleaving or splitting.,,,,,,
Cleavage ,"n.) The quality possessed by many crystallized substances of splitting readily in one or more definite directions, in which the cohesive attraction is a minimum, affording more or less smooth surfaces; the direction of the dividing plane; a fragment obtained by cleaving, as of a diamond. See Parting.",,,,,,
Cleavage ,"n.) Division into laminae, like slate, with the lamination not necessarily parallel to the plane of deposition; -- usually produced by pressure.",,,,,,
Cleaved ,imp.) of Cleave,,,,,,
Clave ,) of Cleave,,,,,,
Cleaved ,p. p.) of Cleave,,,,,,
Cleaving ,p. pr. & vb. n.) of Cleave,,,,,,
Cleave ,v. i. ) To adhere closely; to stick; to hold fast; to cling.,,,,,,
Cleave ,v. i. ) To unite or be united closely in interest or affection; to adhere with strong attachment.,,,,,,
Cleave ,v. i. ) To fit; to be adapted; to assimilate.,,,,,,
Cleft ,imp.) of Cleave,,,,,,
Clove ,) of Cleave,,,,,,
Cleft ,p. p.) of Cleave,,,,,,
Cleaved ,) of Cleave,,,,,,
Cloven ,) of Cleave,,,,,,
Cleave ,v. t.) To part or divide by force; to split or rive; to cut.,,,,,,
Cleave ,v. t.) To part or open naturally; to divide.,,,,,,
Cleave ,"v. i.) To part; to open; to crack; to separate; as parts of bodies; as, the ground cleaves by frost.",,,,,,
Cleavelandite ,"n.) A variety of albite, white and lamellar in structure.",,,,,,
Cleaver ,"n.) One who cleaves, or that which cleaves; especially, a butcher's instrument for cutting animal bodies into joints or pieces.",,,,,,
Cleavers ,n.) A species of Galium ,"G. Aparine), having a fruit set with hooked bristles, which adhere to whatever they come in contact with; -- called also, goose grass, catchweed, etc.",,,,,
Cleche ,"a.) Charged with another bearing of the same figure, and of the color of the field, so large that only a narrow border of the first bearing remains visible; -- said of any heraldic bearing. Compare Voided.",,,,,,
Clechy ,a.) See Cleche.,,,,,,
Cledge ,n.) The upper stratum of fuller's earth.,,,,,,
Cledgy ,"a.) Stiff, stubborn, clayey, or tenacious; as, a cledgy soil.",,,,,,
Clee ,n.) A claw.,,,,,,
Clee ,n.) The redshank.,,,,,,
Clef ,n.) A character used in musical notation to determine the position and pitch of the scale as represented on the staff.,,,,,,
Cleft ,) imp. & p. p. from Cleave.,,,,,,
Cleft ,a.) Divided; split; partly divided or split.,,,,,,
Cleft ,"a.) Incised nearly to the midrib; as, a cleft leaf.",,,,,,
Cleft ,"n.) A space or opening made by splitting; a crack; a crevice; as, the cleft of a rock.",,,,,,
Cleft ,"n.) A piece made by splitting; as, a cleft of wood.",,,,,,
Cleft ,n.) A disease in horses; a crack on the band of the pastern.,,,,,,
Cleft-footed ,a.) Having a cloven foot.,,,,,,
Cleftgraft ,v. t.) To ingraft by cleaving the stock and inserting a scion.,,,,,,
Cleg ,n.) A small breeze or horsefly.,,,,,,
Cleistogamic ,a.) Alt. of Cleistogamous,,,,,,
Cleistogamous ,"a.) Having, beside the usual flowers, other minute, closed flowers, without petals or with minute petals; -- said of certain species of plants which possess flowers of two or more kinds, the closed ones being so constituted as to insure self-fertilization.",,,,,,
Clem ,v. t. & i.) To starve; to famish.,,,,,,
Clematis ,"n.) A genus of flowering plants, of many species, mostly climbers, having feathery styles, which greatly enlarge in the fruit; -- called also virgin's bower.",,,,,,
Clemence ,n.) Clemency.,,,,,,
Clemencies ,pl. ) of Clemency,,,,,,
Clemency ,"n.) Disposition to forgive and spare, as offenders; mildness of temper; gentleness; tenderness; mercy.",,,,,,
Clemency ,"n.) Mildness or softness of the elements; as, the clemency of the season.",,,,,,
Clement ,a.) Mild in temper and disposition; merciful; compassionate.,,,,,,
Clementine ,"a.) Of or pertaining to Clement, esp. to St. Clement of Rome and the spurious homilies attributed to him, or to Pope Clement V. and his compilations of canon law.",,,,,,
Clench ,n. & v. t.) See Clinch.,,,,,,
Cleped ,imp. & p. p.) of Clepe,,,,,,
Cleping ,p. pr. & vb. n.) of Clepe,,,,,,
Ycleped ,) of Clepe,,,,,,
Clepe ,"v. t.) To call, or name.",,,,,,
Clepe ,v. i.) To make appeal; to cry out.,,,,,,
Clepsine ,"n.) A genus of fresh-water leeches, furnished with a proboscis. They feed upon mollusks and worms.",,,,,,
Clepsydra ,"n.) A water clock; a contrivance for measuring time by the graduated flow of a liquid, as of water, through a small aperture. See Illust. in Appendix.",,,,,,
Cleptomania ,n.) See Kleptomania.,,,,,,
Clerestory ,n.) Same as Clearstory.,,,,,,
Clergeon ,n.) A chorister boy.,,,,,,
Clergial ,a.) Learned; erudite; clerical.,,,,,,
Clergical ,a.) Of or pertaining to the clergy; clerical; clerkily; learned.,,,,,,
Clergy ,"n.) The body of men set apart, by due ordination, to the service of God, in the Christian church, in distinction from the laity; in England, usually restricted to the ministers of the Established Church.",,,,,,
Clergy ,"n.) Learning; also, a learned profession.",,,,,,
Clergy ,n.) The privilege or benefit of clergy.,,,,,,
Clergyable ,"a.) Entitled to, or admitting, the benefit of clergy; as, a clergyable felony.",,,,,,
Clergymen ,pl. ) of Clergyman,,,,,,
Clergyman ,"n.) An ordained minister; a man regularly authorized to preach the gospel, and administer its ordinances; in England usually restricted to a minister of the Established Church.",,,,,,
Cleric ,"n.) A clerk, a clergyman.",,,,,,
Cleric ,a.) Same as Clerical.,,,,,,
Clerical ,a.) Of or pertaining to the clergy; suitable for the clergy.,,,,,,
Clerical ,"a.) Of or relating to a clerk or copyist, or to writing.",,,,,,
Clericalism ,n.) An excessive devotion to the interests of the sacerdotal order; undue influence of the clergy; sacerdotalism.,,,,,,
Clericity ,n.) The state of being a clergyman.,,,,,,
Clerisy ,"n.) The literati, or well educated class.",,,,,,
Clerisy ,"n.) The clergy, or their opinions, as opposed to the laity.",,,,,,
Clerk ,n.) A clergyman or ecclesiastic.,,,,,,
Clerk ,n.) A man who could read; a scholar; a learned person; a man of letters.,,,,,,
Clerk ,"n.) A parish officer, being a layman who leads in reading the responses of the Episcopal church service, and otherwise assists in it.",,,,,,
Clerk ,"n.) One employed to keep records or accounts; a scribe; an accountant; as, the clerk of a court; a town clerk.",,,,,,
Clerk ,n.) An assistant in a shop or store.,,,,,,
Clerk-ale ,n.) A feast for the benefit of the parish clerk.,,,,,,
Clerkless ,a.) Unlearned.,,,,,,
Clerklike ,a.) Scholarlike.,,,,,,
Clerkliness ,n.) Scholarship.,,,,,,
Clerkly ,a.) Of or pertaining to a clerk.,,,,,,
Clerkly ,adv.) In a scholarly manner.,,,,,,
Clerkship ,"n.) State, quality, or business of a clerk.",,,,,,
Cleromancy ,n.) A divination by throwing dice or casting lots.,,,,,,
Cleronomy ,n.) Inheritance; heritage.,,,,,,
Clerstory ,n.) See Clearstory.,,,,,,
Clever ,"a.) Possessing quickness of intellect, skill, dexterity, talent, or adroitness; expert.",,,,,,
Clever ,"a.) Showing skill or adroitness in the doer or former; as, a clever speech; a clever trick.",,,,,,
Clever ,"a.) Having fitness, propriety, or suitableness.",,,,,,
Clever ,a.) Well-shaped; handsome.,,,,,,
Clever ,a.) Good-natured; obliging.,,,,,,
Cleverish ,a.) Somewhat clever.,,,,,,
Cleverly ,adv.) In a clever manner.,,,,,,
Cleverness ,n.) The quality of being clever; skill; dexterity; adroitness.,,,,,,
Clevis ,"n.) A piece of metal bent in the form of an oxbow, with the two ends perforated to receive a pin, used on the end of the tongue of a plow, wagen, etc., to attach it to a draft chain, whiffletree, etc.; -- called also clavel, clevy.",,,,,,
Clew ,n.) Alt. of Clue,,,,,,
Clue ,"n.) A ball of thread, yarn, or cord; also, The thread itself.",,,,,,
Clue ,n.) That which guides or directs one in anything of a doubtful or intricate nature; that which gives a hint in the solution of a mystery.,,,,,,
Clue ,"n.) A lower corner of a square sail, or the after corner of a fore-and-aft sail.",,,,,,
Clue ,n.) A loop and thimbles at the corner of a sail.,,,,,,
Clue ,n.) A combination of lines or nettles by which a hammock is suspended.,,,,,,
Clewing ,imp. & p. p. & vb. n.) of Clew,,,,,,
Clew ,"n.) To direct; to guide, as by a thread.",,,,,,
Clew ,n.) To move of draw ,"a sail or yard) by means of the clew garnets, clew lines, etc.; esp. to draw up the clews of a square sail to the yard.",,,,,
Cliche ,"n.) A stereotype plate or any similar reproduction of ornament, or lettering, in relief.",,,,,,
Clicked ,imp. & p. p.) of Click,,,,,,
Clicking ,p. pr. & vb. n.) of Click,,,,,,
Click ,"v. i.) To make a slight, sharp noise ","or a succession of such noises), as by gentle striking; to tick.",,,,,
Click ,v. t.) To move with the sound of a click.,,,,,,
Click ,"v. t.) To cause to make a clicking noise, as by striking together, or against something.",,,,,,
Click ,"n.) A slight sharp noise, such as is made by the cocking of a pistol.",,,,,,
Click ,"n.) A kind of articulation used by the natives of Southern Africa, consisting in a sudden withdrawal of the end or some other portion of the tongue from a part of the mouth with which it is in contact, whereby a sharp, clicking sound is produced. The sounds are four in number, and are called cerebral, palatal, dental, and lateral clicks or clucks, the latter being the noise ordinarily used in urging a horse forward.",,,,,,
Click ,v. t.) To snatch.,,,,,,
Click ,"n.) A detent, pawl, or ratchet, as that which catches the cogs of a ratchet wheel to prevent backward motion. See Illust. of Ratched wheel.",,,,,,
Click ,n.) The latch of a door.,,,,,,
Click beetle ,) See Elater.,,,,,,
Clicker ,n.) One who stands before a shop door to invite people to buy.,,,,,,
Clicker ,n.) One who as has charge of the work of a companionship.,,,,,,
Clicket ,n.) The knocker of a door.,,,,,,
Clicket ,n.) A latch key.,,,,,,
Clicky ,a.) Resembling a click; abounding in clicks.,,,,,,
Clidastes ,"n.) A genus of extinct marine reptiles, allied to the Mosasaurus. See Illust. in Appendix.",,,,,,
Cliency ,n.) State of being a client.,,,,,,
Client ,"n.) A citizen who put himself under the protection of a man of distinction and influence, who was called his patron.",,,,,,
