Amolika,Priceless
Ayushi,One with a long life
Pankaj,Lotus
Jotika,Light
Accost ,"v. t.) ,To join side to side; to border; hence, to sail along the coast or side of.",,,,,,
Accost ,v. t.) To approach; to make up to.,,,,,,
Accost ,v. t.) To speak to first; to address; to greet.,,,,,,
Accost ,v. i.) To adjoin; to lie alongside.,,,,,,
Accost ,n.) Address; greeting.,,,,,,
Accostable ,a.) Approachable; affable.,,,,,,
Accosted ,"a.) Supported on both sides by other charges; also, side by side.",,,,,,
Accouchement ,n.) Delivery in childbed,,,,,,
Accoucheur ,n.) A man who assists women in childbirth; a man midwife; an obstetrician.,,,,,,
Accoucheuse ,n.) A midwife.,,,,,,
Account ,"n.) A reckoning; computation; calculation; enumeration; a record of some reckoning; as, the Julian account of time.",,,,,,
Account ,"n.) A registry of pecuniary transactions; a written or printed statement of business dealings or debts and credits, and also of other things subjected to a reckoning or review; as, to keep one's account at the bank.",,,,,,
Account ,"n.) A statement in general of reasons, causes, grounds, etc., explanatory of some event; as, no satisfactory account has been given of these phenomena. Hence, the word is often used simply for reason, ground, consideration, motive, etc.; as, on no account, on every account, on all accounts.",,,,,,
Account ,"n.) A statement of facts or occurrences; recital of transactions; a relation or narrative; a report; a description; as, an account of a battle.",,,,,,
Account ,n.) A statement and explanation or vindication of one's conduct with reference to judgment thereon.,,,,,,
Account ,n.) An estimate or estimation; valuation; judgment.,,,,,,
Account ,n.) Importance; worth; value; advantage; profit.,,,,,,
Accounted ,imp. & p. p.) of Account,,,,,,
Accounting ,p. pr. & vb. n.) of Account,,,,,,
Account ,v. t.) To reckon; to compute; to count.,,,,,,
Account ,v. t.) To place to one's account; to put to the credit of; to assign; -- with to.,,,,,,
Account ,"v. t.) To value, estimate, or hold in opinion; to judge or consider; to deem.",,,,,,
Account ,v. t.) To recount; to relate.,,,,,,
Account ,"v. i.) To render or receive an account or relation of particulars; as, an officer must account with or to the treasurer for money received.",,,,,,
Account ,"v. i.) To render an account; to answer in judgment; -- with for; as, we must account for the use of our opportunities.",,,,,,
Account ,"v. i.) To give a satisfactory reason; to tell the cause of; to explain; -- with for; as, idleness accounts for poverty.",,,,,,
Accountability ,n.) The state of being accountable; liability to be called on to render an account; accountableness.,,,,,,
Accountable ,"a.) Liable to be called on to render an account; answerable; as, every man is accountable to God for his conduct.",,,,,,
Accountable ,a.) Capable of being accounted for; explicable.,,,,,,
Accountable ness ,n.) The quality or state of being accountable; accountability.,,,,,,
Accountably ,adv.) In an accountable manner.,,,,,,
Accountancy ,n.) The art or employment of an accountant.,,,,,,
Accountant ,n.) One who renders account; one accountable.,,,,,,
Accountant ,n.) A reckoner.,,,,,,
Accountant ,"n.) One who is skilled in, keeps, or adjusts, accounts; an officer in a public office, who has charge of the accounts.",,,,,,
Accountant ,a.) Accountable.,,,,,,
Accountantship ,n.) The office or employment of an accountant.,,,,,,
Account book ,) A book in which accounts are kept.,,,,,,
Accouple ,v. t.) To join; to couple.,,,,,,
Accouplement ,"n.) The act of coupling, or the state of being coupled; union.",,,,,,
Accouplement ,"n.) That which couples, as a tie or brace.",,,,,,
Accourage ,v. t.) To encourage.,,,,,,
Accourt ,v. t.) To treat courteously; to court.,,,,,,
Accoutered ,imp. & p. p.) of Accoutre,,,,,,
Accoutred ,) of Accoutre,,,,,,
Accoutering ,p. pr. & vb. n.) of Accoutre,,,,,,
Accoutring ,) of Accoutre,,,,,,
Accouter ,v. t.) Alt. of Accoutre,,,,,,
Accoutre ,"v. t.) To furnish with dress, or equipments, esp. those for military service; to equip; to attire; to array.",,,,,,
Accouterments ,n. pl.) Alt. of Accoutrements,,,,,,
Accoutrements ,"n. pl.) Dress; trappings; equipment; specifically, the devices and equipments worn by soldiers.",,,,,,
Accoy ,v. t.) To render quiet; to soothe.,,,,,,
Accoy ,v. t.) To subdue; to tame; to daunt.,,,,,,
Accredited ,imp. & p. p.) of Accredit,,,,,,
Accrediting ,p. pr. & vb. n.) of Accredit,,,,,,
Accredit ,v. t.) To put or bring into credit; to invest with credit or authority; to sanction.,,,,,,
Accredit ,"v. t.) To send with letters credential, as an ambassador, envoy, or diplomatic agent; to authorize, as a messenger or delegate.",,,,,,
Accredit ,v. t.) To believe; to credit; to put trust in.,,,,,,
Accredit ,v. t.) To credit; to vouch for or consider ,"some one) as doing something, or ",something) as belonging to some one.,,,,
Accreditation ,"n.) The act of accrediting; as, letters of accreditation.",,,,,,
Accrementitial ,a.) Pertaining to accremention.,,,,,,
Accrementition ,"n.) The process of generation by development of blastema, or fission of cells, in which the new formation is in all respect like the individual from which it proceeds.",,,,,,
Accresce ,v. i.) To accrue.,,,,,,
Accresce ,v. i.) To increase; to grow.,,,,,,
Accrescence ,n.) Continuous growth; an accretion.,,,,,,
Accrescent ,a.) Growing; increasing.,,,,,,
Accrescent ,a.) Growing larger after flowering.,,,,,,
Accrete ,v. i.) To grow together.,,,,,,
Accrete ,v. i.) To adhere; to grow ,to); to be added; -- with to.,,,,,
Accrete ,v. t.) To make adhere; to add.,,,,,,
Accrete ,"a.) Characterized by accretion; made up; as, accrete matter.",,,,,,
Accrete ,a.) Grown together.,,,,,,
Accretion ,n.) The act of increasing by natural growth; esp. the increase of organic bodies by the internal accession of parts; organic growth.,,,,,,
Accretion ,"n.) The act of increasing, or the matter added, by an accession of parts externally; an extraneous addition; as, an accretion of earth.",,,,,,
Accretion ,"n.) Concretion; coherence of separate particles; as, the accretion of particles so as to form a solid mass.",,,,,,
Accretion ,"n.) A growing together of parts naturally separate, as of the fingers toes.",,,,,,
Accretion ,"n.) The adhering of property to something else, by which the owner of one thing becomes possessed of a right to another; generally, gain of land by the washing up of sand or sail from the sea or a river, or by a gradual recession of the water from the usual watermark.",,,,,,
Accretion ,"n.) Gain to an heir or legatee, failure of a coheir to the same succession, or a co-legatee of the same thing, to take his share.",,,,,,
Accretive ,"a.) Relating to accretion; increasing, or adding to, by growth.",,,,,,
Accriminate ,v. t.) To accuse of a crime.,,,,,,
Accroach ,"v. t.) To hook, or draw to one's self as with a hook.",,,,,,
Accroach ,"v. t.) To usurp, as jurisdiction or royal prerogatives.",,,,,,
Accroachment ,n.) An encroachment; usurpation.,,,,,,
Accrual ,n.) Accrument.,,,,,,
Accrued ,imp. & p. p.) of Accrue,,,,,,
Accruing ,p. pr. & vb. n.) of Accrue,,,,,,
Accrue ,n.) To increase; to augment.,,,,,,
Accrue ,"n.) To come to by way of increase; to arise or spring as a growth or result; to be added as increase, profit, or damage, especially as the produce of money lent.",,,,,,
Accrue ,n.) Something that accrues; advantage accruing.,,,,,,
Accruer ,"n.) The act of accruing; accretion; as, title by accruer.",,,,,,
Accrument ,"n.) The process of accruing, or that which has accrued; increase.",,,,,,
Accubation ,"n.) The act or posture of reclining on a couch, as practiced by the ancients at meals.",,,,,,
Accumb ,"v. i.) To recline, as at table.",,,,,,
Accumbency ,n.) The state of being accumbent or reclining.,,,,,,
Accumbent ,"a.) Leaning or reclining, as the ancients did at their meals.",,,,,,
Accumbent ,"a.) Lying against anything, as one part of a leaf against another leaf.",,,,,,
Accumbent ,n.) One who reclines at table.,,,,,,
Accumber ,v. t.) To encumber.,,,,,,
Accumulated ,imp. & p. p.) of Accumulate,,,,,,
Accumulating ,p. pr. & vb. n.) of Accumulate,,,,,,
Accumulate ,"v. t.) To heap up in a mass; to pile up; to collect or bring together; to amass; as, to accumulate a sum of money.",,,,,,
Accumulate ,v. i.) To grow or increase in quantity or number; to increase greatly.,,,,,,
Accumulate ,a.) Collected; accumulated.,,,,,,
Accumulation ,"n.) The act of accumulating, the state of being accumulated, or that which is accumulated; as, an accumulation of earth, of sand, of evils, of wealth, of honors.",,,,,,
Accumulation ,n.) The concurrence of several titles to the same proof.,,,,,,
Accumulative ,a.) Characterized by accumulation; serving to collect or amass; cumulative; additional.,,,,,,
Accumulator ,"n.) One who, or that which, accumulates, collects, or amasses.",,,,,,
Accumulator ,"n.) An apparatus by means of which energy or power can be stored, such as the cylinder or tank for storing water for hydraulic elevators, the secondary or storage battery used for accumulating the energy of electrical charges, etc.",,,,,,
Accumulator ,"n.) A system of elastic springs for relieving the strain upon a rope, as in deep-sea dredging.",,,,,,
Accuracy ,"n.) The state of being accurate; freedom from mistakes, this exemption arising from carefulness; exact conformity to truth, or to a rule or model; precision; exactness; nicety; correctness; as, the value of testimony depends on its accuracy.",,,,,,
Accurate ,"a.) In exact or careful conformity to truth, or to some standard of requirement, the result of care or pains; free from failure, error, or defect; exact; as, an accurate calculator; an accurate measure; accurate expression, knowledge, etc.",,,,,,
Accurate ,a.) Precisely fixed; executed with care; careful.,,,,,,
Accurately ,adv.) In an accurate manner; exactly; precisely; without error or defect.,,,,,,
Accurateness ,n.) The state or quality of being accurate; accuracy; exactness; nicety; precision.,,,,,,
Accurse ,v. t.) To devote to destruction; to imprecate misery or evil upon; to curse; to execrate; to anathematize.,,,,,,
Accursed ,p. p. & a.) Alt. of Accurst,,,,,,
Accurst ,"p. p. & a.) Doomed to destruction or misery; cursed; hence, bad enough to be under the curse; execrable; detestable; exceedingly hateful; -- as, an accursed deed.",,,,,,
Accusable ,a.) Liable to be accused or censured; chargeable with a crime or fault; blamable; -- with of.,,,,,,
Accusal ,n.) Accusation.,,,,,,
Accusant ,n.) An accuser.,,,,,,
Accusation ,n.) The act of accusing or charging with a crime or with a lighter offense.,,,,,,
Accusation ,"n.) That of which one is accused; the charge of an offense or crime, or the declaration containing the charge.",,,,,,
Accusatival ,a.) Pertaining to the accusative case.,,,,,,
Accusative ,a.) Producing accusations; accusatory.,,,,,,
Accusative ,a.) Applied to the case ,"as the fourth case of Latin and Greek nouns) which expresses the immediate object on which the action or influence of a transitive verb terminates, or the immediate object of motion or tendency to, expressed by a preposition. It corresponds to the objective case in English.",,,,,
Accusative ,n.) The accusative case.,,,,,,
Accusatively ,adv.) In an accusative manner.,,,,,,
Accusatively ,adv.) In relation to the accusative case in grammar.,,,,,,
Accusatorial ,a.) Accusatory.,,,,,,
Accusatorially ,adv.) By way accusation.,,,,,,
Accusatory ,"a.) Pertaining to, or containing, an accusation; as, an accusatory libel.",,,,,,
Accuse ,n.) Accusation.,,,,,,
Accused ,imp. & p. p.) of Accuse,,,,,,
Accusing ,p. pr. & vb. n.) of Accuse,,,,,,
Accuse ,"v. t.) To charge with, or declare to have committed, a crime or offense",,,,,,
Accuse ,"v. t.) to charge with an offense, judicially or by a public process; -- with of; as, to accuse one of a high crime or misdemeanor.",,,,,,
Accuse ,v. t.) To charge with a fault; to blame; to censure.,,,,,,
Accuse ,v. t.) To betray; to show. [L.],,,,,,
Accused ,"a.) Charged with offense; as, an accused person.",,,,,,
Accusement ,n.) Accusation.,,,,,,
Accuser ,n.) One who accuses; one who brings a charge of crime or fault.,,,,,,
Accusingly ,adv.) In an accusing manner.,,,,,,
Accustomed ,imp. & p. p.) of Accustom,,,,,,
Accustoming ,p. pr. & vb. n.) of Accustom,,,,,,
Accustom ,"v. t.) To make familiar by use; to habituate, familiarize, or inure; -- with to.",,,,,,
Accustom ,v. i.) To be wont.,,,,,,
Accustom ,v. i.) To cohabit.,,,,,,
Accustom ,n.) Custom.,,,,,,
Accustomable ,a.) Habitual; customary; wonted.,,,,,,
Accustomably ,adv.) According to custom; ordinarily; customarily.,,,,,,
Accustomance ,n.) Custom; habitual use.,,,,,,
Accustomarily ,adv.) Customarily.,,,,,,
Accustomary ,a.) Usual; customary.,,,,,,
Accustomed ,a.) Familiar through use; usual; customary.,,,,,,
Accustomed ,a.) Frequented by customers.,,,,,,
Accustomedness ,n.) Habituation.,,,,,,
Aces ,pl. ) of Ace,,,,,,
Ace ,"n.) A unit; a single point or spot on a card or die; the card or die so marked; as, the ace of diamonds.",,,,,,
Ace ,n.) Hence: A very small quantity or degree; a particle; an atom; a jot.,,,,,,
Aceldama ,"n.) The potter's field, said to have lain south of Jerusalem, purchased with the bribe which Judas took for betraying his Master, and therefore called the field of blood. Fig.: A field of bloodshed.",,,,,,
Acentric ,a.) Not centered; without a center.,,,,,,
Acephal ,n.) One of the Acephala.,,,,,,
Acephala ,"n. pl.) That division of the Mollusca which includes the bivalve shells, like the clams and oysters; -- so called because they have no evident head. Formerly the group included the Tunicata, Brachiopoda, and sometimes the Bryozoa. See Mollusca.",,,,,,
Acephalan ,n.) Same as Acephal.,,,,,,
Acephalan ,a.) Belonging to the Acephala.,,,,,,
Acephali ,n. pl.) A fabulous people reported by ancient writers to have heads.,,,,,,
Acephali ,n. pl.) A Christian sect without a leader.,,,,,,
Acephali ,n. pl.) Bishops and certain clergymen not under regular diocesan control.,,,,,,
Acephali ,n. pl.) A class of levelers in the time of K. Henry I.,,,,,,
Acephalist ,n.) One who acknowledges no head or superior.,,,,,,
Acephalocyst ,"n.) A larval entozoon in the form of a subglobular or oval vesicle, or hydatid, filled with fluid, sometimes found in the tissues of man and the lower animals; -- so called from the absence of a head or visible organs on the vesicle. These cysts are the immature stages of certain tapeworms. Also applied to similar cysts of different origin.",,,,,,
Acephalocystic ,"a.) Pertaining to, or resembling, the acephalocysts.",,,,,,
Acephalous ,a.) Headless.,,,,,,
Acephalous ,a.) Without a distinct head; -- a term applied to bivalve mollusks.,,,,,,
Acephalous ,"a.) Having the style spring from the base, instead of from the apex, as is the case in certain ovaries.",,,,,,
Acephalous ,a.) Without a leader or chief.,,,,,,
Acephalous ,a.) Wanting the beginning.,,,,,,
Acephalous ,"a.) Deficient and the beginning, as a line of poetry.",,,,,,
Acerate ,n.) A combination of aceric acid with a salifiable base.,,,,,,
Acerate ,a.) Acerose; needle-shaped.,,,,,,
Acerb ,"a.) Sour, bitter, and harsh to the taste, as unripe fruit; sharp and harsh.",,,,,,
Acerbate ,v. t.) To sour; to imbitter; to irritate.,,,,,,
Acerbic ,a.) Sour or severe.,,,,,,
Acerbitude ,n.) Sourness and harshness.,,,,,,
Acerbity ,"n.) Sourness of taste, with bitterness and astringency, like that of unripe fruit.",,,,,,
Acerbity ,"n.) Harshness, bitterness, or severity; as, acerbity of temper, of language, of pain.",,,,,,
Aceric ,"a.) Pertaining to, or obtained from, the maple; as, aceric acid.",,,,,,
Acerose ,a.) Having the nature of chaff; chaffy.,,,,,,
Acerose ,"a.) Needle-shaped, having a sharp, rigid point, as the leaf of the pine.",,,,,,
Acerous ,a.) Same as Acerose.,,,,,,
Acerous ,"a.) Destitute of tentacles, as certain mollusks.",,,,,,
Acerous ,"a.) Without antennae, as some insects.",,,,,,
Acerval ,a.) Pertaining to a heap.,,,,,,
Acervate ,v. t.) To heap up.,,,,,,
Acervate ,"a.) Heaped, or growing in heaps, or closely compacted clusters.",,,,,,
Acervation ,n.) A heaping up; accumulation.,,,,,,
Acervative ,a.) Heaped up; tending to heap up.,,,,,,
Acervose ,a.) Full of heaps.,,,,,,
Acervuline ,a.) Resembling little heaps.,,,,,,
Acescence ,n.) Alt. of Acescency,,,,,,
Acescency ,n.) The quality of being acescent; the process of acetous fermentation; a moderate degree of sourness.,,,,,,
Acescent ,a.) Turning sour; readily becoming tart or acid; slightly sour.,,,,,,
Acescent ,n.) A substance liable to become sour.,,,,,,
Acetable ,n.) An acetabulum; or about one eighth of a pint.,,,,,,
Acetabular ,a.) Cup-shaped; saucer-shaped; acetabuliform.,,,,,,
Acetabulifera ,"n. pl.) The division of Cephalopoda in which the arms are furnished with cup-shaped suckers, as the cuttlefishes, squids, and octopus; the Dibranchiata. See Cephalopoda.",,,,,,
Acetabuliferous ,"a.) Furnished with fleshy cups for adhering to bodies, as cuttlefish, etc.",,,,,,
Acetabuliform ,"a.) Shaped like a shallow cup; saucer-shaped; as, an acetabuliform calyx.",,,,,,
Acetabulum ,"n.) A vinegar cup; socket of the hip bone; a measure of about one eighth of a pint, etc.",,,,,,
Acetabulum ,n.) The bony cup which receives the head of the thigh bone.,,,,,,
Acetabulum ,n.) The cavity in which the leg of an insect is inserted at its articulation with the body.,,,,,,
Acetabulum ,n.) A sucker of the sepia or cuttlefish and related animals.,,,,,,
Acetabulum ,n.) The large posterior sucker of the leeches.,,,,,,
Acetabulum ,n.) One of the lobes of the placenta in ruminating animals.,,,,,,
Acetal ,"n.) A limpid, colorless, inflammable liquid from the slow oxidation of alcohol under the influence of platinum black.",,,,,,
Acetaldehyde ,n.) Acetic aldehyde. See Aldehyde.,,,,,,
Acetamide ,"n.) A white crystalline solid, from ammonia by replacement of an equivalent of hydrogen by acetyl.",,,,,,
Acetanilide ,"n.) A compound of aniline with acetyl, used to allay fever or pain; -- called also antifebrine.",,,,,,
Acetarious ,"a.) Used in salads; as, acetarious plants.",,,,,,
Acetary ,"n.) An acid pulp in certain fruits, as the pear.",,,,,,
Acetate ,"n.) A salt formed by the union of acetic acid with a base or positive radical; as, acetate of lead, acetate of potash.",,,,,,
Acetated ,a.) Combined with acetic acid.,,,,,,
Acetic ,"a.) Of a pertaining to vinegar; producing vinegar; producing vinegar; as, acetic fermentation.",,,,,,
Acetic ,"a.) Pertaining to, containing, or derived from, acetyl, as acetic ether, acetic acid. The latter is the acid to which the sour taste of vinegar is due.",,,,,,
Acetification ,"n.) The act of making acetous or sour; the process of converting, or of becoming converted, into vinegar.",,,,,,
Acetifier ,n.) An apparatus for hastening acetification.,,,,,,
Acetified ,imp. & p. p.) of Acetify,,,,,,
Acetifying ,p. pr. & vb. n.) of Acetify,,,,,,
Acetify ,v. t.) To convert into acid or vinegar.,,,,,,
Acetify ,v. i.) To turn acid.,,,,,,
Acetimeter ,n.) An instrument for estimating the amount of acetic acid in vinegar or in any liquid containing acetic acid.,,,,,,
Acetimetry ,"n.) The act or method of ascertaining the strength of vinegar, or the proportion of acetic acid contained in it.",,,,,,
Acetin ,n.) A combination of acetic acid with glycerin.,,,,,,
Acetize ,v. i.) To acetify.,,,,,,
Acetometer ,n.) Same as Acetimeter.,,,,,,
Acetone ,"n.) A volatile liquid consisting of three parts of carbon, six of hydrogen, and one of oxygen; pyroacetic spirit, -- obtained by the distillation of certain acetates, or by the destructive distillation of citric acid, starch, sugar, or gum, with quicklime.",,,,,,
Acetonic ,"a.) Of or pertaining to acetone; as, acetonic bodies.",,,,,,
Acetose ,a.) Sour like vinegar; acetous.,,,,,,
Acetosity ,n.) The quality of being acetous; sourness.,,,,,,
Acetous ,a.) Having a sour taste; sour; acid.,,,,,,
Acetous ,"a.) Causing, or connected with, acetification; as, acetous fermentation.",,,,,,
Acetyl ,"n.) A complex, hypothetical radical, composed of two parts of carbon to three of hydrogen and one of oxygen. Its hydroxide is acetic acid.",,,,,,
Acetylene ,"n.) A gaseous compound of carbon and hydrogen, in the proportion of two atoms of the former to two of the latter. It is a colorless gas, with a peculiar, unpleasant odor, and is produced for use as an illuminating gas in a number of ways, but chiefly by the action of water on calcium carbide. Its light is very brilliant.",,,,,,
Ach ,n.) Alt. of Ache,,,,,,
Ache ,"n.) A name given to several species of plants; as, smallage, wild celery, parsley.",,,,,,
Achaean ,a.) Alt. of Achaian,,,,,,
Achaian ,"a.) Of or pertaining to Achaia in Greece; also, Grecian.",,,,,,
Achaian ,n.) A native of Achaia; a Greek.,,,,,,
Acharnement ,n.) Savage fierceness; ferocity.,,,,,,
Achate ,n.) An agate.,,,,,,
Achate ,n.) Purchase; bargaining.,,,,,,
Achate ,n.) Provisions. Same as Cates.,,,,,,
Achatina ,"n.) A genus of land snails, often large, common in the warm parts of America and Africa.",,,,,,
Achatour ,n.) Purveyor; acater.,,,,,,
Ache ,"v. i.) Continued pain, as distinguished from sudden twinges, or spasmodic pain. ""Such an ache in my bones.""",,,,,,
Ached ,imp. & p. p.) of Ache,,,,,,
Aching ,p. pr. & vb. n.) of Ache,,,,,,
Ache ,"v. i.) To suffer pain; to have, or be in, pain, or in continued pain; to be distressed.",,,,,,
Achean ,"a & n.) See Achaean, Achaian.",,,,,,
Achene ,n.) Alt. of Achenium,,,,,,
Achenium ,"n.) A small, dry, indehiscent fruit, containing a single seed, as in the buttercup; -- called a naked seed by the earlier botanists.",,,,,,
Achenial ,a.) Pertaining to an achene.,,,,,,
Acheron ,"n.) A river in the Nether World or infernal regions; also, the infernal regions themselves. By some of the English poets it was supposed to be a flaming lake or gulf.",,,,,,
Acherontic ,"a.) Of or pertaining to Acheron; infernal; hence, dismal, gloomy; moribund.",,,,,,
Achievable ,a.) Capable of being achieved.,,,,,,
Achievance ,n.) Achievement.,,,,,,
Achieved ,imp. & p. p.) of Achieve,,,,,,
Achieving ,p. pr. & vb. n.) of Achieve,,,,,,
Achieve ,"v. t.) To carry on to a final close; to bring out into a perfected state; to accomplish; to perform; -- as, to achieve a feat, an exploit, an enterprise.",,,,,,
Achieve ,"v. t.) To obtain, or gain, as the result of exertion; to succeed in gaining; to win.",,,,,,
Achieve ,v. t.) To finish; to kill.,,,,,,
Achievement ,"n.) The act of achieving or performing; an obtaining by exertion; successful performance; accomplishment; as, the achievement of his object.",,,,,,
Achievement ,"n.) A great or heroic deed; something accomplished by valor, boldness, or praiseworthy exertion; a feat.",,,,,,
Achievement ,n.) An escutcheon or ensign armorial; now generally applied to the funeral shield commonly called hatchment.,,,,,,
Achiever ,n.) One who achieves; a winner.,,,,,,
Achillean ,"a.) Resembling Achilles, the hero of the Iliad; invincible.",,,,,,
Achilles' tendon ,"n.) The strong tendon formed of the united tendons of the large muscles in the calf of the leg, an inserted into the bone of the heel; -- so called from the mythological account of Achilles being held by the heel when dipped in the River Styx.",,,,,,
Achilous ,a.) Without a lip.,,,,,,
Aching ,a.) That aches; continuously painful. See Ache.,,,,,,
Achiote ,"n.) Seeds of the annotto tree; also, the coloring matter, annotto.",,,,,,
Achlamydate ,a.) Not possessing a mantle; -- said of certain gastropods.,,,,,,
Achlamydeous ,"a.) Naked; having no floral envelope, neither calyx nor corolla.",,,,,,
Acholia ,n.) Deficiency or want of bile.,,,,,,
Acholous ,a.) Lacking bile.,,,,,,
Achromatic ,a.) Free from color; transmitting light without decomposing it into its primary colors.,,,,,,
Achromatic ,a.) Uncolored; not absorbing color from a fluid; -- said of tissue.,,,,,,
Achromatically ,adv.) In an achromatic manner.,,,,,,
Achromaticity ,n.) Achromatism.,,,,,,
Achromatin ,n.) Tissue which is not stained by fluid dyes.,,,,,,
Achromatism ,"n.) The state or quality of being achromatic; as, the achromatism of a lens; achromaticity.",,,,,,
Achromatization ,n.) The act or process of achromatizing.,,,,,,
Achromatized ,imp. & p. p.) of Achromatize,,,,,,
Achromatizing ,p. pr. & vb. n.) of Achromatize,,,,,,
Achromatize ,v. t.) To deprive of color; to make achromatic.,,,,,,
Achromatopsy ,n.) Color blindness; inability to distinguish colors; Daltonism.,,,,,,
Achronic ,a.) See Acronyc.,,,,,,
Achroodextrin ,n.) Dextrin not colorable by iodine. See Dextrin.,,,,,,
Achroous ,a.) Colorless; achromatic.,,,,,,
Achylous ,a.) Without chyle.,,,,,,
Achymous ,a.) Without chyme.,,,,,,
Aciculae ,pl. ) of Acicula,,,,,,
Acicula ,"n.) One of the needlelike or bristlelike spines or prickles of some animals and plants; also, a needlelike crystal.",,,,,,
Acicular ,"a.) Needle-shaped; slender like a needle or bristle, as some leaves or crystals; also, having sharp points like needless.",,,,,,
Aciculate ,a.) Alt. of Aciculated,,,,,,
Aciculated ,a.) Furnished with aciculae.,,,,,,
Aciculated ,a.) Acicular.,,,,,,
Aciculated ,a.) Marked with fine irregular streaks as if scratched by a needle.,,,,,,
Aciculiform ,a.) Needle-shaped; acicular.,,,,,,
Aciculite ,n.) Needle ore.,,,,,,
Acid ,"a.) Sour, sharp, or biting to the taste; tart; having the taste of vinegar: as, acid fruits or liquors. Also fig.: Sour-tempered.",,,,,,
Acid ,"a.) Of or pertaining to an acid; as, acid reaction.",,,,,,
Acid ,n.) A sour substance.,,,,,,
